4/29/2008,"interesting profession, and not one i morally support, but accept it as part of the eve sandbox. off the top of my head ...in terms of the features for thieves, i would think along the lines of the ability to skill-based hack secure cans anchored in space - perhaps linked to the duration before expiry of the can, similarly perhaps for hacking pos. you could even extend it to hacking secure cans in corporation hangers.to balance this, maybe:- the skill level of the anchoring person determines the level of difficulty to hack the can and a ""kill-right"" or similar given to the person who's can was being hacked. - a long-length time-out on being able to make another attempt on the same canto make this effective would need a mechanic implemented to buying/selling kill-rights for bounty hunters to track down and kill thieves to be effective. imo this area is all about balance. as a thief, you could game this mechanism by:- manipulating the market for your own kill-rights, thus buying up anyone else's ability to kill you at prices under the value of the cargo you looted. - (or) game the mechanism by looting your own alts cargo to bump up your kill prices to high levels - this in turn would would need to be balanced by bounties on your head. -- of course you could game that by placing a massive bounty on your own head and only undocking to loot more of your own cans. that would need to be balanced by displaying how many kill-rights are currently in circulation for your thief.and so on ... at the end of the day it needs a good thinking through of the issues of balance."
4/29/2008,there were a couple of reasons:- i was close to the deadline before organising my personal and work life to be ready to take the commitment the csm requires.- i'm not one for long speeches- the intention was to have a simple message that is easy to remember while highlighting the core values i bring to the role- it should ring true to anyone who i have had contact with in eve- i aimed to pique players interest to click the link for my personal site.your assumption that i could not be bothered is false.
4/29/2008,"no, i was just putting that there as i am currently at work and don't have the time to fill it out properly yet - better something for everyone to read than nothing at all."
4/29/2008,vote oz for his drive for a different voting system!
4/29/2008,"you don't have your corp-tag on and i don't recognize your name. additionally, i have to ask a question so i don't get the hose for trolling: how do plan on over-coming the slight obstacle that no one knows who you?"
4/29/2008,"a fair question, thank you for the opportunity to reply:i am known in the eve community, but maybe in different circles than those you travel within? i have been mostly involved in the science/blueprint/manufacturing/trading side of eve for the past 2.5 years. ask about (try the bpo channel) - i'm that guy that has been asking for conflagration m bpo's for the past 2 years. i realise that it is hard to get a feeling for candidates that you have not personally dealt with in-game before. i have nothing to hide, so feel free to pose reasonable questions!take care,bruce hansen"
4/29/2008,"to all candidates, what changes, if any, would you suggest for the invention process?feel free to admit a lack of knowledge on the subject."
4/29/2008,"three words: more decryptor seeding!prices for these, since they now coming from exploration sites, have gone upwards and now make module invention using them unprofitable (for many modules).i also have seen some good ideas regarding me/pe research after invention on bpc. what do others feel/think about such ideas?take care,bruce hansen"
4/29/2008,"like arithron i whod like to see more seeding of decryptors.even the idea off me/pe research is somewhat a good idea, that will level the playing ground between bpo and copies, though it can have a bad turnout in the long run.edit:i have just started with the invention part of the game so i dont have any extensive know all to it"
4/29/2008,"hi all. wow <looks around and looks for a spot to camp at> i'll try to keep it short an simple. but if you have any questions by all means feel free to ask.to vote for me, click here.who am i in game?i've been playing since november 2006. i play and live primarily in 0.0 space.the corporation i am in is not currently affiliated with the ""great war"" and have chosen to go it alone for the time being seeking fun pvp.more detailswho am i out of game?i am 42 years old and work in tech support for the uk national health service. i've ran various guilds and community sites over the last several years.more detailswhy should we vote for you?those that know me, know that i am fair and impartial. my belief is that the role of the csm is to bring player issues to discussion via the csm forum. interviews have focussed on asking me to reveal what issues i believe are important and while that avenue has scope and engenders an almost presidential style election i believe it is inappropriate as views can and possibly should change given new information.i do feel it important though that ideas and views can be discussed, that way you can get a feel for a candidate but hopefully that does not get mistaken for an agenda. my only agenda is to work with the other csm's and ccp in order to help a better experience for the players come to fruition. more information: to vote for me, click here.my main campaign pagemy blog in chronological order, most recent firsta compilation of recent interviewsthanks."
4/29/2008,"goons care first and foremost about making the game fun to play, because goons play the game first and foremost to have fun. and this is where my loyalties lie. we aren't here to make partisan game changes that only benefit us, but benefit the game as a whole. goons won't play the game if its not fun, they will go ride bikes instead. such it is in the best interests of goonswarm to make the game fun for as many people and play styles as possible and i cannot see that conflicting in any way with what is best for the community."
4/29/2008,"how do you feel about **********'s actions towards ccp, were they the wrong actions for the right reasons, or otherwise. please explain in detail."
4/29/2008,"besides the very obvious ""balance"" there are a few key axioms in eve that bind it together.1. eve is game and should be fun2. specialization should produce decreasing marginal returns3. everyone and everything has a role.4. there should be no hegemony of the rich or old[also, see point 2]5. risk should correlate positively with reward.if you can hold to these then you can really make the game a better place for everyone involved. currently a few are failing.ed: if i mischaracterize your question please let me know and ill change it right up."
4/29/2008,"whistleblowers are important and need to be protected, but i am not knowledgeable enough on the subject to know just what it was he did and what he did may not be kosher. if all he did was publish information he gained from willing sources, no big deal. if he used malicious means then its much more iffy[as he likely would have had no reason to take such actions].**********has taken other actions against player groups and many times these have been malicious and illegal and these types of activities should not be tolerated.i hope to get a feel for what ia is doing to police the developers[no developer should probably ever be coordinating an alliances capital ops and planning for instance], but i am not sure about what types of information we will have access too nor what we will be able to release."
4/29/2008,quoting this
4/29/2008,so which is it?
4/29/2008,what do you mean? the two positions are not mutually exclusive.
4/29/2008,"also, do you have a campaign platform at all, as i haven't seen anything even hinting that you do."
4/29/2008,it would help if you actually had a signature idk
4/29/2008,"try turning signatures on in your forum options.otherwise, click here"
4/29/2008,"this post has been cleared of inappropriate content.regards,the eve online moderation team"
4/29/2008,"i'm curious; in a game that's so intensely capitalistic, why do you think that there should be no hegemony of the rich? where are you going with this idea?"
4/29/2008,the logoff(ski) issue?1) capital logoffs (15 minute timer)2) bs logoff at jump in
4/29/2008,"can you expand on these points pls.they already do as far as i am aware its called stacking penalties can you be more specific pls.is this in reference to the titan and the fact that a lot of your alliance seem to think a blob of friggies should be able to tackle and kill them, or are you referring to something else and if so what?.this point seems to be saying that those who work hard are smart, successful and have been working at it for a long time should not benefit from it.id like you to also explain this in detail as well pls."
4/29/2008,"question: please explain the answers in this postto start with, lecrotta, i would appreciate it if you did not troll this thread. you have a main and can post with it, and if not, then your previous statements disqualify you from having a reasoned debate on this subject as can be seen by the ignorance and strawman you have already spewed forth in your short time here. e.g.but to answer your questions, the list is a guide of how you ought to balance eve. such the ""i thought this happened"" has no relevance. if its happening its good. there are areas where it is not happening[speed/agility and tech 2 cruisers specifically, and these break a few of the other axioms as well]. but that is really besides the point other than the issue that not conforming with the axioms they ought to be changed so that they do.regarding titans. again, this is a point of balance. everyone needs to be useful in order to keep everyone having fun. no one believes that we should be able to kill a titan with frigates, please refrain from strawman in the future.you are confusing hegemony with benefit. they are two very different terms with two very different meanings. eve has never been a game where the rich or old can dominate the poor. not in design ideal, nor in execution. there have been points where this has failed[and fails now], but it is still a core design principle. to give an example of this hegemony in another game, you could look at wow. if you are not level 70 with epic gear[or very close], don't bother fighting others, keep grinding npcs and run away from the others.but eve is, at its core, a pvp game, and hegemony destroys that. especially hegemony of the rich and old for they offer no real way to breach.there is nothing to explain, maybe you should try a dictionary if you don't understand what is going on with such a simple statement as this one.and now to address the non-trollhegemony of the rich and old creates a perpetual subservience of the poor and young. this is explicitly bad for the game as fewer players will wish to continue past their trial. why would they when they cannot have any effect until they are old and rich, where in those who are old and rich now will be even more powerful by the time they get there?this point goes hand in hand with the specialization point and the risk/reward point. when there is a hegemony of the rich and old they are able to exploit low risk situations for higher reward and their specialization is rewarded in strength and not just versatility. instead of having a higher risk for that higher reward and less value for that specialization.this creates old guards that only die when their will to play the game ends. this is not fun for anyone really. it means less young people will continue to play the game and it means less change in politics and sovereignty. the game thrives on both of these things."
4/29/2008,"i was not trolling i was asking for clarification on several of your points and i would post with my main but he is banned for posting cat pictures on caod.now i downloaded your documents and read through them and found them well presented if a little vague and now im asking for clarification on the bullet points you put on here, you did say you would answer them after all."
4/29/2008,can you explain what you want clarified? because most of what i posted is fairly self explanatory. do you want to know why i think these axioms are central to how eve should be balanced? do you want to know what a specific balance created by these i think should be implemented?
4/29/2008,"you posted a list of ideals and not ideas, now ideals are great but you can use them to justify all manner of unnecessary changes after the fact. so what i am asking for is a list of things that you consider are most in need of changing, with these ideals as the principal reason for the change:2. specialization should produce decreasing marginal returns3. everyone and everything has a role.4. there should be no hegemony of the rich or old[also, see point 2]5. risk should correlate positively with reward."
4/29/2008,"the same thing i said in the top issues threadspecifically i want to make it much easier to attack strategic and economic pos modules[though i would add a reinforcement timer on them. i want to reduce the strength and effectiveness of aoes. there was an idea of making a dd into an ewar module which seemed like it would be really nice to keep it useful but not overpowered and game breaking.i want to possibly move dreads off grid from their targets[while only making them effective against pos's and capitals.regarding speed, i think there needs to be more and stronger counters. i think that smaller ships should have more inherent advantage via sig radius and speed and i think speed mods need looking at. this touches on hegemony, role, specialization and risk. [specifically probably my web idea, though final numbers would need to be tweaked, and i would either revert speed mods back to pre-revelations status, or i would separate them into +speed, + agility, and - signature radius with no overlap]u.i. just pertains to the usability of the game in general which touches on point one and the rest of the points if it increases functionality in a way that takes a lot of the disadvantage out of not knowing the u.i."
4/29/2008,"without wanting to be accused of being a strawman it seems to me that all you have done is rephrase your pet gripes about the ddd, nano and cloaking/scanning into a more positive sounding format. id hoped it was not true and that you would have put together considerably more and varied content but it seems im going to be disapointed.this is what i feel a candidate should offer:but all you seem to be doing is pushing your own agenda and personal issues from your own limited perspective of the game."
4/29/2008,"i am not sure why you would consider these ""pet gripes"". if i have ever had a ""pet gripe"" it would have clearly been the amarran problems[and i disagreed with many of the solutions they implemented]. these problems shown in ddd, nano, and cloaking/scanning are problems which are very significant and integral to the game[i also note how you conveniently ignore the issues with pos's], they are not pet issues of mine but issues which affect all players in the game in negative ways. they are the largest issues of the moment and since that is what you asked about, that is what i talked about.there are certainly others, remote sensor damps and tracking disruptor stacking, the inability of small ships to be valuable due to webs, the problems with leadership skills, the problem of tiering(you will need to scroll down to post 11, the direct link does not seem to be working), the problems of overlapping ship design which currently effects the maller, prophecy, abaddon, tempest, punisher, as well as a variety of other ships, and how we can quickly and easily make good changes to pos warfare.there will certainly be more[u.i. usability, bad target calling mechanics, problems with deaggressing timers not scaling well, problems with specific ships, lack of market based economic warfare, lack of structure to form proper isk based loans and other contract overhauls(while good they can easily be improved)]. but if i had the time to deal with all of those i would be a game developer and not a csm candidate.do not be confused with the issues i bring up and my own agenda, most of the time i will bring up an issue because i feel that changing it will benefit the game as a whole. also do not be confused with my ability to recognize good ideas and expand and bring them forth.the simply pos spam solution, and the movement of dreads off grid were both not my solutions. i was not the one who originally proposed increasing the drone bay on the tempest. i was not the one who originally proposed increasing clip size of artillery. i have not been the first to want market based economic warfare, i was not the first to propose simply scanning down cloaked ships nor was i to propose rat aggression timers[i think]. i am absolutely certain that i was not the first to come up with some afs being moved to the leadership line. i am not under the illusion that my ideas are necessarily the best, though naturally i feel they have strong merit or i would not have proposed them. but i do feel that the ideas i propose and bring to the table, whether or not they are mine, are all strong ideas and the problems that they hope to solve are all important."
4/29/2008,i will not deny that some of your ideas have merit although a lot of them seem to reduce the overall effectiveness of single ship types/styles of fit and lean towards a one ship can combat all style of eve. and while this may seem like a good idea to less skilled and newer players it also takes away the ability for ppl to put together a gang or fleet of varied specialized ships and pilots in favor of conformity and universal fitting/ship types.
4/29/2008,"motives for jihadswarm as stated by the goonswarm rep:""vile rat emphasized that this was not a campaign against new pod pilots, but against those who by now should be making it in lawless space with all of its dangers."" (source)i.e., goonswarm has a definitive view on who should be playing where and doing what, and those who do not should be coerced through force. that sounds pretty clear to me.how do you reconcile this with the public statements of members of goonswarm that they are not in fact ""playing eve,"" but instead playing their own game. this game is one which transcends eve and in which ""fun"" is defined as causing trouble and distress for others, and for which the end goal is to make other players close their accounts and stop playing? (source)apparently, not all of your alliance agrees with the motives and objectivs you claim they have. why should the playerbase trust your motives to be any different?"
4/29/2008,"in this case, they are. either kugutsmen's actions were right or they were wrong. which is it?"
4/29/2008,"i never intend to move towards ""one ship can combat all styles"". and would say instead that i want to move away from that. i think you are referring to nano-ships at the moment so i will address this with regards to that. with nano-ships it is the exact problem that the tech 2 cruisers when fit for speed are so strong that their abilities overshadow the abilities of all other ships and fits to the point where if you want to compete[and by compete, i mean 'kill these types of ships'] you need to have about as many of these ships in your fleet as your opponent. it has come to the point where major alliances simply don't use frigates anymore[a good example is bob, which no longer flies interceptors and dictors in favor of recaons/hacs/hictors]. simply because the frigates are superfluous in all types of combat.the specific problem can be exemplified by looking at two specific ships. the first is the thorax, and the second is the brutix. when fit for speed, a brutix performs the same role that the thorax does, except better, it has more hit points, more dps, longer range[larger blasters], the same size drone bay, is faster and as agile[or more agile and as fast], it locks targets faster, and has a better active tank[when both are fit as such]. and this is not ""it does any one of these things"" but ""it does all of these things better at the same time"". unless the thorax fits speed mods[something it should not have to do for various reasons] the brutix actually makes a better thorax than the thorax."
4/29/2008,"actually the brutix fits the same sized guns just two more of them than the thorax and yes its a better ship than the thorax in all regards cos its a battlecruiser instead of just a cruiser.it seems to me that you want to stop ppl from upgrading as nobody who can fly a ceptor or a af would fly a normal t1 frigate, nobody who could fly a interdictor or hic would fly a ceptor and so on and so on. your trying to devolve ppl, ships and modules/fitting styles who have spent a lot of isk and time training for ships that are improvements over lower sp ones they have outgrown."
4/29/2008,"from reading what g is saying is that 1 set of ships isn't supposed to obsolete the other, in other words the brutix obsoletes the thorax making it pointless to use a thorax. a battlecruiser should have a role, not obsolete its smaller variation. i have a ? though for g, i understand your reasoning behind the brutix and thorax, what are your ideas behind thorax and diemos. obviously the diemos obsoletes it. do you believe the t2 ship should be penalized or left as is?"
4/29/2008,"no, the brutix will be fitting higher tier blasters. not larger as in large > medium. larger as in bigger. unless the thorax is fitting neutron blasters[in which case the brutix has just as much range].no, its that the upgrade from these types of ships is much too severe. the value you gain too much. it is not that people should not be flying these ships but the advantage that they bring does not correlate with the risk. currently the game is very nearly ""don't come unless you can fly a t2 cruiser or better"". because they pretty much obsolete everything below them.it seems to me you are simply attempting to strawman me instead of addressing the actual argument."
4/29/2008,"posted with an alt (kaben), usually don't care who i post with but will post with main."
4/29/2008,"most of the t2 ships should be left as they are so long as the means that they use to make themselves overpowered is reduced. that a deimos is stronger than a thorax is not a huge issue, since both are very ""generalist"" ships and don't benefit from the advantages of speed mods. the increased benefit of flying the deimos comes at a significantly higher risk.[which is not really so with a brutix due to insurance, and also not so with the majority of t2 cruisers].it would be nice if the deimos had a specialist role like most other hacs, but i don't see that as something we could reasonably change today.the key point is that there is a much smaller difference between the deimos and thorax than there are between the other hacs which mainly comes in their ability to be fast, agile, and do significant dps outside of web range without sacrificing much of anything.such, instead of the deimos being 25% better than a thorax at its primary role[dps in the short range] with 25-30% more ehp, the hacs are 25% better at doing dps with survival rates with 50% more ehp, while going 100% faster, while being able to dps from 50% farther away. these factors combine to make them be able to disengage too easily. disengaging too easily lowers risk below the value that will correlate with our increased risk/reward model that eve has going for it."
4/29/2008,how is it? whether his actions are o.k. are dependent on information that i do not know about and such cannot answer. nor is it exclusive that you ought to protect whistle blowers but not protect illegal actions to obtain that information.
4/29/2008,"a t2 cruiser or better fitted t2 costs at least 200 mil with rigs how can you say that its wrong for a ship like this to far outclass all ships below it, cos as far as im concerned it should far out class them. this is my issue with your ideas as they are reducing what ppl have ratted trained and paid monthly fees for a long time to achieve, yes in eve right now there is a lot of t2 ships about but also there are a lot of ppl training for them because they are great fun to fly, remember your ""make eve lots of fun"" number one rule."
4/29/2008,"another question, which you will probably ignore as well, but i am asking it of several candidates who did the same thing, so in the interest of fairness i direct it to you as well:given the likelihood that many players may vote after doing nothing more than reading the candidate profiles (here), why is it that you felt it unimportant or unnecessary to exert a minimal amount of effort and post some key aspects of yourself or points of your campaign? as i see it, the candidate profile is the single most important place to get your point accross clearly and concisely, as it will be read by the most players, and many will never see anything else. if you can't put forth anything to catch voters' interest here, they're not going to bother following a url with no description attached.if you could not be bothered to do the work necessary to put out your information in your profile, why should we believe that you are up to the task of doing all the work that will be associated with a seat on the csm?"
