4/30/2008,"okay then spoon, first thing i have to say is that while my gut feeling remains that even sovereignty 1 from pos is wrong, i do think the idea of general attackable infrastructure items away from the pos guns and thereby valid targets for raiding and conflict has some merit. that though said though, why not just make it about planets? make sovereignty about putting orbital facilities (headquarters, administrative hubs, propaganda centres and such) in the orbits above planets and have the actual sovereignty of a system determined by the collective loyalty of the planetary population. let both sides influence this by blowing up/establishing orbital facilities and dropping trade goods and equipment down to the planetary population (luxuries and flash grav vehicles to bribe them, guns and bombs and nerve gas to increase instability). make the business of sovereignty about blockade running, interdiction and generally influencing the simulated politics in the system.(thats all a bit blue sky and planetary environment-tastic but it would be a way of simulating sovereignty without pos.)and thats a key point i keep coming back too spoon-thumb. i think sovereignty from pos is the greatest single problem that links all other 0.0 problems with dynamism. they are blob-makers. they are the things you have to hit if you want to cause lasting damage and conquest or nullify conquest and the nature of the things makes warfare boring and blob-tastic. hard to shoot down, impossible to destroy in one sitting, reinforcement timer means you have no initiative and will have to fight the collective war-blob of the defenders (and every other nap member) in order to destroy it. its a concept that hugely damages the war-simulation in 0.0, the whole reinforcement timer paradigm has had a terrible effect and these are the real underlying issues.now i like some of your bullets, the sliding scale is good, its nice for industrialists to have something to build, its good to have intermediate objectives for small/medium gangs to hit. but without actually dealing with the problem of pos being the sovereignty claimers at core (youd still have to destroy / outspam all pos in an outpost system to take the outpost) you havent really dealt with the core issue.re tactical environments  definitely, i love the concept and it would really help differentiate terrain and engagement variety. callais made a really good post on the subject in my removing local / discussion thread. herein conclusion while there are good ideas there spoonthumb, i still think you havent tackled the basic problem of pos/sovereignty role in 0.0 wars. these things are a strong disincentive to a dynamic environment  they promote forced alarm-clock blobbing and a two-speed culture in 0.0 (caps/everything else). as a concept they just dont work. ultimately having a nuanced system for increased sovereignty levels is a pretty good idea, but if the foundation level is still about pos spamming, you have the same old problem for the attacker in that theyve got to destroy or outspam the enemy pos network to attack the outposts."
4/30/2008,are you going to answer my questions or ignore me like you do anytime someone blows on your house of cards?
4/30/2008,"you're pulling my heartstrings, jade! +1 vote"
4/30/2008,"thank you very much for your endorsement. its very gratifying to see people taking a deep interest in these issues and looking at the big picture for the future of the game. i think its why it was very important to express the whole scope of opinions and general candidate understanding of current gameplay issues; the eve electorate really needs to know who its voting for and to have faith and confidence in the vision, passion, and general fellow-gamer insight into these concerns on the csm."
4/30/2008,"1) becomes an issue with uber tanks that can shrug off damage for 15 minutes definitely. i know full well that expensively-fitted amarrian carriers and motherships can pretty much achieve this with triage/uber bonuses and simply disappear if things look dodgy. much more a potential problem in the small gang/pirating/lowsec hot-drop environment too because likely enemies just don't have a dps on hand to kill them in the time limit. longer aggression timers on bigger ship hulls? (maybe 30mins for cap ships). its annoying i understand that you might have to spend a bit longer cloaked on disengage before you can log off a capital ship, but might be a price worth paying to counter logoffski in fleet combats and skirmishes. 2) is just rubbish really. it shouldn't happen. i guess one fix might be counting bubbles as ""aggression"" against an incoming ship (even while cloaked) so that its impossible to simply do the log off and disappear in 60 secs trick. i can imagine that being a tricky programming issue though so i'm very open to suggestions on this. but the principle is clear, i think its a nasty little cheat/marginal exploit to do the log-off at jump-in while cloaked and subvert the aggression timer.to which (on this general subject) i'll add another peeve based on timers and thats the deaggression/redock timer. here's the thing, we've been through multiple iterations of ship hit-point boasts and buffs. ships today are 2-3 times harder to kill than they were a few years ago. but redock/jump timers are the same as they ever were. this means that aggression/dock/undock ""games"" are more common and powerful than they should be and realistically this is a very easy fix and something i'd definitely like to see dealt with. when 0.0 fighting becomes about dock/undock games with fat tanked ships leaving the bay, shooting off some rounds and then de-agressing to dock again seconds after there is a problem. it encourages overwhelming force/hot-drops as only way of killing in time and is a blob attractor as a result. cheesy tactics like these need clear fixes and its not unreasonable to increase the dock/jump timers in line with the hit point buffs that all ships have received in my opinion."
4/30/2008,"pos aren't broken, sov mechanics are. pos serve two functions atm; claiming a system and boosting sov level. you need to decouple claiming sov from sov levels. pos make sense as the method for claiming. a new system is needed for the levelling, which is what i proposed.---why not do this with planetary interaction? because you can have both. planetary interaction is a ""soon(tm)"". i'd rather not wait a year and a half to see sov mechanics get changed just so they can fit neatly in with planetary interaction.in fact, the sov system should be changed first, so that when planetary interaction comes, it slots in perfectly, and feels like a mere extension of an existing system rather than something imposed on top.---to elaborate:sliding scale sov should not have set levels. instead you have sov points like cuture points in civ 4. anchoring more pos in a system than a rival is equivalent to capturing a city in civ 4. it shows on the map as yours and resets the culture points to zero. if the city has temples and libraries, you gain control of them and start gaining culture points from them. if the enemy in their retreat however burned the temples and libraries, you have to rebuild them, which takes time and you get no points in the meantimeas you go past certain set levels of culture points, you get more squares of land around your city and less ""angry citizens"" or whatever.---in eve, this translates into the small and medium sized targets being the schools and hospitals that gain you ""sov points"" (pos would not get you any points alone). you don't magically get fuel bonuses from out of nowhere after a set length of time like atm.instead, for each sov point you get, it knocks some amount off the cost of fuel for starbases, because the local population who run your pos and man your reactors are healthier and better educatedequally, you can anchor a flat pack cyno jammer any time you want, but to attract the specialists who are qualified to run it, you need to have a certain quality of life in your system for its inhabitance. this level is represented by 4000 sov points or whateveredit: this fits in with the complaint that sov is artificial and why should you suddenly be able to magically anchor something that you couldn't yesterday when nothing has changed except a number in some concord database---what i'm really saying is that small corps and alliances should not be able to take sov from big ones. but they can make that sov meaningless."
4/30/2008,"thank you proxay, and i love the image too! much appreciated"
4/30/2008,\o/ my votes are in for hardin tbh
4/30/2008,"thanks verone - your endorsement is appreciated. regarding kelsin's questions i find it quite amusing that you need to know all this information when its quite clear that you are operating as jade's chief cheerleader - if not her unofficial campaign manager is there a realistic possibility that my answers will convince you to vote for me or are you just trying to make me say something stupid which you can jump up and down on and go 'nah na na na nah hardin is an idiot'? you first asked me which issues i was interested in - i gave you a list - were you happy no - now you want specifics - but specifics on carefully selected topics. will you be happy with those - probably not! nevertheless, i will rise to the bait.roleplay (enhancing): i would like ccp to take roleplay more seriously. i know that many knock 'roleplay' in eve but the backstory and history is of interest to large groups of players (probably more than we think). i would like to see an eve which is more dynamic in relation to roleplay, where the old established empires 'react', 'respond' and 'interact' with players and player empires more than they currently do.i would like to see more recognition given to pod pilot politics in the shape of 'empire' reactions to the initiatives of both individual pod pilots, corporations and alliances - although this is an area in which ccp has already improved massively of late (and this is an area in which ccp has to tread carefully to avoid claims of bias)i would like to see ccp endorse and support efforts such as eve front - which will give players the opportunity to contribute to the history and immersion of this game.and of course i would like storylines to progress a little faster and more logically. hell the amarr empire has been without an emperor for the past year with little to no ic justification. it is not good enough!i will also be interested in seeing the details of factional warfare and ensuring that this is something that adds to the roleplay of eve rather than detracts from it."
4/30/2008,"pos warfare (improving): i think pretty much everyone agrees that pos/sov warfare as it stands needs to be reformed. the question is improving it whilst maintaining balance.i do believe defenders should have the advantage to reflect their 'entrenched' state and their initial and ongoing investment (both in isk and time) in defensive structures. i don't think cynojammers are the problem. unless a defender is tipped off (or the attacker extremely incompetent) the initial strike to down a cynojammer (which takes place at a time and place of the attackers choosing) is relatively straightforward and painless.attackers then have the option of leaving those caps in the system until needed. in the event that the attacker does withdraw caps from the system and doesn't interdict the system (allowing the defender to regroup and repair/online cynojammers and jumpbridges) then the attacker is asking for trouble...nevertheless i do think it is excessive that after re-onlining the cynojammer the defender can then move as many assets into the system as it wants using the mechanic of jump bridges. the ability for defenders to uuse jump bridges to jump in multiple super caps and caps to defend a cynojammer (either via doomsdays or remote rep) when an attacker can only use conventionals (assuming the attacker didn't leave their cap fleet in the system after the initial attack) is imho unbalanced towards the defender.my suggestion would be that any jumpbridges put out of action by the attacker in the initial assault cannot be reactivated while there are poses in reinforced in the system. similarly new jumpbridges cannot be installed and activated while there are reinforced poses in a system. in this way if defenders wanted to move caps into a system to defend their cynojammer/poses would have to open a window in their cynojamming protection which the alert/organised attacker could also take advantage of. it also means that the defender will (may) need to fight to get its conventional defence fleet into the system rather than simply bypassing the attackers fleets by using jumpbridges.i am open to other ideas on this subject - but will not support any idea which pushes the balance too far in favour of either side. while siege warfare is tough for the attacker you just have to look at bob's recovery in querious and period basis to see how large well organised attackers can quickly capture space - particularly if the defender is not properly dedicated and motivated. pos maintenance (simplifying): one of the main objections i have to making it easier for attackers to kill poses is the amount of effort that pos owners need to go to to keep the buggers online. pos maintenance (as most people acknowledge) is not much fun and needlessly so.if the process of maintaining and refueling pos structures was simplified and made less demanding then i would certainly look more agreeably on proposals to make their destruction more 'fun' too. however as it stands, i see people investing significant amounts of isk and time in maintaining pos networks (with the exception being those lucky few who have the right moon materials) and believe this should be reflected in the effort that attackers have to go to to remove them.i believe ccp already has some work in progress in this area and look forward to finding out more."
4/30/2008,"0.0 (developing): one of the main reasons i was attracted to eve in the first place was the ability for players to build empires and civilisations in 0.0, empires shaped and molded by us as players and based upon our own ideologies and philosophies - something unique to eve as a single server game. over time ccp have released tools which have allowed alliances to start to develop an infrastructure in 0.0, to actually build real and solid things.since that happened we have seen a fragmentation of alliances. there are more space holding alliances in eve now than at any time in its history and this adds to the flavour and depth of eve politics, which can only be a good thing because inevitably it leads to friction and conflict. yet despite the tools sov holders have been given we still see the majority of eve pilots based in empire. why? the easy answer is that they are all carebears - but the reality is that the infrastructure and economy of most 0.0 regions (and even low-sec) regions still does not offer the economic incentives to outweigh the risk of relocating to 0.0 - nor does the nbsi attitude (an understandable attitude in view of current game mechanics) favoured by the majority of 0.0 alliances.i therefore believe that sov holders should be given further options with which to develop their space and stimulate their economies. one suggestion - which i have seen proposed - is the introduction of 'agents' to outposts with sov holding alliances able to 'pay' agents (the cost would depend on the level of the agent) to relocate to their stations and thus provide another incentive for people to move to 0.0 (of course the sov holding alliance benefits from the docking fees and general economic activity stimulated by this - while the pvpers raiding their space benefit from additional targets without having to worry about their ****ty sec status).of course that particular idea may prove unworkable purely from a technical standpoint (i am not a dev) but i would welcome tools which actually encourage alliances to realistically consider policies beyond the simplistic 'its not blue - shoot it' approach and to actually think about the development of their economies (beyond ratting, mining and moon mining). this is something which will enhance the game long term as it will help populate 0.0, increasing pvp opportunities for us all. i enjoy the depth of eve, the depth in history, the depth of ideologies, the depth of its economy, the depth of playstyles, the depth in tactics, the depth of personalities and the depth in politics but am worried that some want to remove this depth and turn 0.0 into counterstrike in space. i have made it clear in my blog (and above) that i do have a bias in how i view this game. my in game experiences shape these views. this is precisely why i believe i and other csm members should not be pushing specific policies and agendas at this stage. should the electorate have a reasonable idea about our general game philosophy and the type of characters we are - yes they should. but we are being elected to a team, a team which will look at all these ideas and issue and then (hopefully) come to educated and informed decisions which are in the best interests of the game. if the csm ends up being full of people who are standing to promote specific agendas - with no willingness to compromise and look beyond their own interests - then i am not very hopeful as to how this is going to turn out.fortunately, i believe the majority of candidates - candidates such as omber zombie, serenity steele, guomindong, zoolkhan and bane glorious, to name just a few - do have the best interests of the game at heart and i hope i get the chance to work with them."
4/30/2008,hardin is a good guy. hope i get to see him in iceland.
4/30/2008,"just wanted to post my support,you have my vote, well you had my vote even before benilopax twised my arm hehe. good luck mate"
4/30/2008,"posting here to show my/our support.have had many long talks with lavista in vent. he has experienced pretty much everything imaginable in eve from pvp (0.0 and empire) to industry, as well as a complete understanding on the economic side of things.he is an intelligent and rational guy who doesn't mind looking at problems from every aspect. i don't think you'll find a better csm candidate out there. good luck lavista, hopefully if you get elected you'll still have plenty of time for some pew pew!general spazceominmatar mafia"
4/30/2008,"i'll be voting for this homeboy, because he's not zealously for or against any one issue. it means his stances are moderate, non-extreme, and not too crazy. unlike some others ..."
4/30/2008,"i'll ask you the same question i have asked of similar candidates, specifically those who seem to feel it unnecessary to tell the players anything about your own ideas and opinions.what would you say to those of us who believe that a candidate's individual opinions give valuable and necessary insight into their thought process? as a csm representative, you will be required to make choices and decisions on various issues and then vote according to your decision. the players deserve some indication on which way you will lean when faced with these situations, which will be a regular part of your duties as a representative. not stating an opinion makes it appear as though you either have something to hide, or you are completely uninformed about the current issues in game, or you are just plain indecisive. none of these are very attractive characteristics for a representative.your own thoughts and ideas will form an important part of how you weigh arguments and make decisions. why do you not feel it important for your potential voters to know these ideas?"
4/30/2008,"i fully agree with this. i have discussed it with jade on a few occassions, and i think it's damn important.i think while individual opinion is important, it's also important for people to understand why you think so. so i'm trying to take a stance of not just state my opinion, but also create awareness of why the issues happen in the first place, how it manifests and makes a difference for people and why they should care, and how to eventually fix it.that is how i went about writing my first article about the state of the economy. and i have been going hard at providing these kind of conversations on the forums, as well. i think there is so much fud on the forum, that i have been thinking about creating a faq for those kinds of things. we keep comming to the same conclusions every time someone asks the same question. so why not get over with it, and make a nice thread which discusses all the issues, why they happen and how to maybe fix them(those would be ideas, ccp should have a say too, as for how they would prefer things, in order to make it possible in terms of mechanics).edit: rereading your post again, you make it sound like i don't take stances on issues, and that i'm just ""the voice of the community"", who has no interest. it couldn't be further from the truth. i'm heavily biased, if you are to believe some."
4/30/2008,"ok people, let me introduce myself to you.i am a 33 year old engineer, living in munich, germany. i enjoy crunching numbers in games just as much as irl, which is quite helpful in the kind of games i favor (strategy/management).i started playing eve in august 2005, and my main occupation ever since then had been running missions. in highsec, lowsec and recently also 0.0. since my other primary passion (besides killing evil people) involves the pimping of ships, my main focus regarding missions has always been on empire though. i also delve into trading occasionally as that is where the really big bucks are made, but i tend to find it too boring to occupy me for extended periods of time. mining? well i did it for maybe a week once. in my first month of play. never again since then, just not my cup of tea.as far as killing people goes, i am a good guy i guess, as in i take great pleasure in dead pirates, but could never get myself to shoot neutrals in lowsec. out in 0.0 though, i am a firm believer in nbsi, even while i consider that same doctrine in lowsec to be simple piracy and thus fight it there if i can.and even though i have been in player corporations for pretty much my entire eve-life, i believe the ability to also achieve things solo is of utmost importance to the success of eve as a game.about my agenda:seeing how i am such a mission ***** at heart, my primary agenda would be to counter the 'move all l4s to lowesec' people that we will undoubtedly get on the council. as far as balance is concerned with missions, i would fight for the status quo, as i see it working out quite okay the way it is atm. no need to make it any worse by moving them to lowsec or nuking bounties, but neither any need to boost them by increasing bounties or improving loot quality. (loot composition on the other hand definitely needs to be fixed, frigate abs from bs wrecks always irk me). lowsec itself (and also the low end 0.0) do need a boost imho, but this must not come at the expense of highsec dwellers.as far as piracy goes, i realize that we need pirates to keep the game exciting, but we also need some limits for them to keep them from spoiling the game too much for the more peaceful folks. so while i sometimes endorse boosts even for what is my chosen enemy, they must not always have their way. moderation is the clue.only if you are a suicide ganker, logontrapper, gang invite sploiter or any other such lowlife you definitely do not want me on the council, as i am vehemently opposed to such cheesy tactics that will yield maximum rewards for minimal risks at the expense of unsuspecting players.moving on towards ships and modules, which i consider my primary area of expertise, you will get total balance out of me. i never specialized in any races' ships, which means i can (and do) fly almost every subcapital ship and use all modules to good effect. meaning i have no personal agenda to further 'my' race over the others simply because there is no 'my' race. instead, i strive to achieve my idea of balance. which basically is described by 'different but equally capable'.as far as pvp mechanics go, i am a small gang fellow with very little care for long range fleet fights or pos sieges. i am quite opposed to the current nano trend, at least for cruisers and above. in my book, the line between big and small ships is drawn below cruisers. so frigs and dessies should be able to nano themselves to their hearts content and the speedtank should be a viable defense for them. for cruisers and above though (and that includes the vagabond), i don't mind them going fast if they are made for that, but them using that speed as actual tank should not work anymore."
