4/1/2008,"@imperator jora'hfirst of, thank you for the many kind words (interwoven with the rest)i appriciate those more than you perhaps know.--free trip to iceland... tbh it's an inconvinience for me, as, if elected, i'd have to take some days of work.and i've be"
4/1/2008,"@zensti have a wet dream that roughly looks something like thisplease visit your user settings to re-enable images.it should be self evident what it shows - and i'm not going to spend alot of thought on it here, unless by demand.as i honestly dont see ccp"
4/1/2008,"i disagree.first of all, most csm candidates point out how much they know about the game, etc. if you (csm people) only needed to _listen_, why would you need that knowledge? just jot down whatever we're saying and pass it on to ccp, simple no? anyone could be csm.i think you need to participate. in any discussion on the forums here, we're trying to convince each other of various points and nuances related to whatever topic. and it's better for us to convince you that what we're saying makes sense than it is for you to just copy it down to give it to ccp without caring about or understanding the details. i'd rather argue with you than write ""tornsoul, give this to ccp: blah blah blah. and bring back an answer.""besides, sometimes a ""this won't work because of x reason"" is just as valid coming from you as it is coming from ccp, since you have all that experience with the game and can tell what works and what doesn't. we don't need to wait for ccp to tell us that they won't add arkonor roids to lowsec, for example, you can explain just as well as they can why that's not balanced and won't be added, should a discussion about it spring up."
4/1/2008,i agree experience and knowledge is important attributes for csm memberswhich is excactly why i also saidi didnt intend to imply that the csm should simply take anything thrown at them and present to ccp without giving it some thought and giving some feedback themself as well.in fact i believe that feedback will be the main factor by wich the csm members ultimatly will be judged.
4/1/2008,"i implied in my earlier posts in this thread that i have done that and considered listing them here as well. but it seemed this thread was about you so i did not deem it appropriate to expand it to include your opponents in here. actually it was another candidate that got me checking up because from my view it seemed they sort of appeared out of nowhere. i appreciate the addition of more calm and well reasoned voices on the forums. i just wish they had been around more and found the reason they now appeared was for the csm. why not before if they are so interested in eve?well, it is not necessarily repeating when responding to a lengthy thread. your voice can be used to further debunk an idea or to support it (with new arguments or just a vote as it were for the idea) or you can modify the idea and bend it a different direction based on what others have written. well, you are correct csm should listen but presumably the csm members are elder statesmen of eve who can sort through the muck and recognize the gems to present to ccp. it is fine and indeed good if they present ideas of their own for consideration. this shows the rest of us the thrust of their thinking and how they handle themselves in the face of flames and their willingness to modify their ideas as more information and new ideas are offered. for instance if someone was just *sure* that concord should be in every system a and will not bend from that view i think it is safe to say we would not want to see that person on the csm (i am not implying you do, just using an extreme to illustrate the idea). not trying to be a pain here but with no posting history to speak of along those lines how are we really to judge?"
4/1/2008,"i was thinking along the lines of perhaps putting it in winterblinks thread, with a post for each candiate, that could then be linked to along with the other links - and perhaps serenity steele will pick it up as well"
4/1/2008,good idea...i had not considered that. i was waiting for the other candidates to stick their necks out here for me have at.
4/2/2008,"the ""forum stats"" were added to all candidates on monday night now if i could just get xml of those stats and show it in a graph ..."
4/2/2008,"yeah i saw that steele.however, what imperator jora'h did was more of a qualitative analysis of the numbers, rather than just listing them.the quantitative listings you've provided (via eve-search) are handy as well - not taking away from that at all.but i'd like to see the qualitative analysis for the others as well ;)) i find it interesting ;)"
4/2/2008,this is going to be hard to pick. i agree with the agenda you are putting for the torn. luck to you.
4/3/2008,"good luck, torn.me and ts go way back, we've built big together as a team. me behind the scenes with all the crazy ideas and him in the foreground being steady and cautious.i know torn personally as a reliable and level-headed person. he's not going to storm into ccp with ideas for sweeping and ultimately unrealistic changes. he'll be able to get the job done, i think, better than anyone.i think that his campaign website is a prime example of his ability to be realistic about what he can accomplish and how he plans to accomplish it.i'm of course about as biased as one could be, but wouldn't you be biased if your best friend ran for election?big and tornsoul both care very much about this game, we've built up a family around it whose ties run deep. we regularly meet in iceland for fanfest, having a large percentage of our members attend both '06 and '07.as for the old website's record of tornsoul being a member since 2002, i believe that tornsoul founded big as soon as he found out what eve was, long before beta even started. so big has existed as a group since long before the game was released, through beta, from the very beginning until the present.he's watched the game develop from the start and i think has a good grounding in what eve was meant to be, and where it can feasibly go.and as far as anything soul of fountain has done, we've just joined so i'm sorry if you've had misgivings about them - but we've only been in the group for a few days.tornsoul isn't that active on these forums for two good reasons. first of all because big's forums are quite active in themselves and tough to keep up with. second because the trolling in these forums can be so intense as to drown out any real discussion about basically anything. me and torn have both felt that one of the best places to discuss anything about eve in a civilized manner is to be at fanfest drinking beer :ppeople with long forum resumes or a history of combat experience does not automatically make them a good candidate. you've gotta look at the whole picture, you're not sending a character to iceland, you're sending a person. and you don't want that person to be nothing more than just an angry nerd or obsessed combat pilot with lots of time to kill. just because that character has been loud on the forums and gotten many kills in-game does not make them the best person to guide ccp in developing eve.i don't think it really matters much that he's not been engaged with the ships & modules forum. is mere ship balance or module fitting issues the only thing that you're concerned with in this game? there is a lot more to eve than ships and shooting! i like my share of pew-pew, but this is a have with far more levels. people only have so much time an attention to spend on a game in the first place, and you can't be everywhere at once - on all of the forums, all the fan sites, running a corp, being in-game, having a social life and a job irl.ps: we were never in cfs. we were in fa, who conquered cfs space (and were subsequently booted out)."
4/6/2008,"it would seem volt silenced everyone there must be more people though, who would like to know my stance/interest on this or that subject though?or something completly different... ?"
4/6/2008,er du dansk ?
4/7/2008,"tjah, mit bud er at danskerne vil overtage csm."
4/7/2008,"this post has been cleared of inappropriate content.regards,the eve online moderation team"
4/7/2008,"## last but not least : the stuff that really really needs to be fixed, because it's outright broken.can you name 3 or more outright broken things with the game currently?"
4/7/2008,"ja - jeg er dansk and i'll be at the gankaton this comming saterday -3 broken things, at the top of my head : territorial warfare (pos warfare beeing just one aspect of this - but probably the most ""visible""/moaned about thing)jumpgate/lane distribution (leading to such things as jita)a myriad of gui stuff/menus/interfaces that really should be fixed... (admittedly, few are ""game breaking"" but still...)"
4/7/2008,ermm... okay call me stupid but i don't think its self evident. will you elaborate? or is it to say empires should be spatially divided by lowsec/nullsec? oh if so then that is hot...
4/7/2008,"self evident after all then i could write page after page after page after page, about all the good stuff(tm) such a distribution would do, and fascilitate in eve.but again... way to radical...i don't see the majority of the player bases wanting it.i don't see ccp wanting it (or rather, deal with the outraged player base if forcing the change)too radical - is why it's just my wet dream"
4/7/2008,if ts does not have time for eve forums why should anyone suppose he has time for csm? he certainly had time to promote big stuff on the forums.if ts cannot stand the trolling why should anyone suppose he is now able to stomach it? what about the inevitable trolls that will pound on the csm? having a forum history does not make a good candidate but it does give people here and ability to see who the candidate is. what they are about. what ideas they support and how they respond to varying ideas and people. we just have to go with you and a few other peoples' opinion that ts is a really good guy. he probably is but i would really like to have seen someone who exhibited a concern and put in an effort to make eve better before the csm came on the scene. if not for the csm i think it is safe to assume we'd never see any of ts's ideas.
4/7/2008,really not going to vote for someone running a lottery.
4/7/2008,"erherm...""tornsoul isn't that active on these forums"" doesnt equal ""if ts does not have time for eve forums""i've already said that i read a humongous amount of posts on the eve forumsi'd say i spend an average of 1h a day, give and take, keeping up-to-date on various topics of interest - and watching for new interesting posts/trends.i'm (no longer) the most prolific poster around (aka ""active on these forums""), granted. i (mostly) prefer to listen (read), and internalize what's going on - for that big picture feel...most issues have most sides debated to death by thousand of other people.while i understand where you're comming from (with regards to knowing ""who i am""), i simply don't (or rarely) have the urge to repeat what has already been said, just to say ""see me, i *also* think x"", on issues 1 through 5000. i'm sorry but that just doesnt ring my bell.if it makes no difference if i make a comment to a post or not, i (usually) prefer not to make it.i prefer to make my opinion known where i feel it either makes a difference or add's something new.the frequency of this seems to not be to your personal liking - so be it.will it mean i won't get enough votes - maybe. so be it.============you saidi've always appreciated the work and honesty with which big has done its thing for eve at large and respect the job it has done for the eve community.and now you say""i would really like to have seen someone who exhibited a concern and put in an effort to make eve better before the csm came on the scene. if not for the csm i think it is safe to assume we'd never see any of ts's ideas.""those don't equate...one paragraph is about big, the other about me specifically (and honestly... saying i haven't done anything for eve before the csm... )those two go very much hand in hand though... so what you say about one, goes for the other as well, to an extreme degree.so both can't be correct."
4/7/2008,(i'll take the bait...)why on earth not?i'd be very intersted in you elaborating on that - seriously.
4/7/2008,"i do not think those two statements are at odds.first though realize my last post was debunking the notions i quoted in that post.as to what you said big has expanded eve in interesting directions. but as i noted before it did so entirely for its own benefit. that is 100% fine and cool. eve as a whole benefitted from what big does but it is not altruism that drives big.tornsoul as a csm candidate is a different matter. while pointing to what you did with big is worth noting it is not the whole answer. tornsoul is not a big representative in csm. tornsoul is supposed to be a representative of all the players of eve on the csm.what happens if an idea comes before the csm to propose to ccp that is contrary to big's interests? if you had posted in the past i and others would have a sense if you will argue for changes that you feel are overall better for eve or if you will protect your corner of it. you can see this clearly in many threads from other people (some few will argue for a better eve, most will kick and scream if you mess with whatever it is no matter how unbalanced).i find the notion that you do not reply because all you have to say has already been said puzzling. surely you have some spipn to offer to an idea. or lend support for a really good idea so maybe ccp will pay attention. or have a new idea all your own you would like vetted on the forums. you certainly seem a bright guy and it sounds like you have lots of ideas. i for one would have liked to hear them and discuss them.i am merely noting i have no good way to assess the above. i also noted before there are some others running who are equally lacking in this department so i'll have to wait and see (and i do mean to point this out in the csm candidate thread when i get some time). i know it looks like i am here to bust your balls but that really is not my intent."
4/7/2008,would you still want the job if there was no free trip to iceland?honestly?
4/7/2008,"and i'm trying to tell you they are if you have a different opinion then i'll simply accept that.as a hypothesis... say big was making most/all of it's isk from t2 prints.say a game change was suggested, that would render t2 prints nearly worthless (comparatively), but would benefit eve overall.i'd back it in a hearth beat.to even have a chance of you believing that, apart from believing that i generally don't go around telling lies , i'd have to tell you a bit about bigbig as a corp is extremely adaptive, we don't put all our egg's in one basket (goes abit against the hypothesis about making most isk of t2 prints - but follow me here...), so any game change, regardless what ccp might throw at us, would not hurt us much.and we're the kind of corp that thrives on a challenge, there's simply *so* many ways in eve to ""have your fun""/""make your isk"", that i honestly don't fear ever hitting that ""big over eve, or eve over big"" dillemma.because should it come, i know what i'd choose already.yes, i also have a (big) obligation towards the well beeing of my corp and it's members as well, but trying to influence eve simply for the sake of a personal (or proxy via my corp) advantage simply won't happen.i'm simply not wired that way...you can believe that or not - it won't change a thing.it's simply how i've always run my (and bigs) affairs.the only example i can give of this, that's remotely relevant, is all the times the big lottery have paid out prizes to ingame enemies.not excactly helping big supplying our enemies with isk is it?it's not the best example, so no reason to knit-pick at it, but it's the best i can think of atm.like i said earlier, i'm honestly looking forward to seeing your analysis of the other canditates. so don't worry."
4/7/2008,"already answered once in this thread...but i'll quote...what i forgot to mention in the above quote, but which is noted on my campaign website, is that i'm also going to ff'08 this year (i assume there'll be a ff'08 ofc )the free trip to iceland for csm members really isn't a lure for me - due to the timing of it (having to take days of work)and come ff'08, i can easily afford to pay my own way to iceland (i got a well paid job...) - so *shrug*."
4/7/2008,"guys seriously those are damn cheap shots. not even i would go to those lows. i personally can't imagine for a minute anyone who would go to those lengths to get a free trip to iceland. the application process, setting up a website, making stuff up to get people to vote you and finally releasing your real name to the whole of eve just for a holiday that you spend with some internet geeks discussing the future of a game of internet spaceships? alrighty... get a grip!"
4/8/2008,you are definately gonna get my votes aswell :)
4/10/2008,thanks zola
4/10/2008,i vote for yuo to.
4/10/2008,no thanks - didn't you make enough of a mess of the fa back in the day?
4/22/2008,"[0.0 space, contested system, 16 jumps from the hisec border]battlegroup delphi consisting 6 megathron class warships, 4 falcon class ew recons, 2 broadsword class heavy interdictors, 6 crow class interceptors:send to fleet, recon element maintains cloak, interception wing quarter the system for contacts maximum range scan. heavy group align for warp, 100,000klick pounce point, realign for inbound on transition. broadswords maintain focused script.this far from empire every everyones nerves are frayed, were in enemy territory, industrial moon mining is evident from maximum range scanning as weve passed through the jumps in combat discipline and now were entering the lions den, bordering occupied outpost systems and expecting enemy contact with each second that passes. the big-black, non-concord space, here combat information is scarce and assessment of enemy presence and disposition is the most precious commodity imaginable, our own group taking every step to hide our capability until battle is joined and fc jealousy denying sight and capability to our foes throughout the transit. contact maximum range, battleship hull, 1, now 3, ive got their heavy ships tightening the scan, found them on 30 degrees towards the outboundroger that ceptor group, focus sweeps on the gate and celestials no engagement intel only. recon1 head to the star under cloak and pop an active probe then bail confirm?confirm sir.heavy group change alignment for the star, maximum range scans 360 maximum alert watch for incoming and cloak signatures.uncertainty, fear, assessment and a gamblers instinct  these the attributes of command on this kind of deep penetration mission against the foe. we both have battleships, those are our cards on the table, our ceptor group for rapid intel, our cloaked assets hidden nature to the enemy until the time of crisis. what we dont have is certainty, the system is too big for our long-range scans to quarter with maximum efficiency, there could be reinforcements beyond the last orbit, this could be a trap, but you can drive yourself insane with this kind of thing, the darkness of the big-black cuts both ways, know your own capabilities first, weve learned that lesson hard and thousands of crew have died to teach us.contact on heavy group, incoming range decreasing multiple ceptor class they know were here!probes in space! im seeing 2 hostile signatures besides our own. getting cloak distortion harmonics within maximum range scan. keep it calm, i want information  assessment from recon wing now.recon confirms - 3 battleship class, 4 interceptors, picking up unknown number of cloaked signatures. its these moments before the battle that so often determine the fate of all under your command. its not too late  we could bail, move the heavy group to a forward ceptor location, 180, run for home. the odds are uncomfortably even at the moment and the cloaked ships on both sides the cards in reserve, our falcon pilots are veterans, magnificent force multipliers and the broadswords will keep the enemy engaged whether he wants it or not but is it all too easy, and is it a trap?got a solution on enemy battleship group, resolution improved, 2 raven class, 1 scorpion, ceptor group in close defencenow or never, with the initiative we can do a lot of damage, and strike first  hit their battlewagons and our group will have one less uncertainty to worry about. close in recon1, warp cloaked to outbound bounce back at 50  go now.in warp  at the gate, no visual outbound, reversing, in warp again  visual now, ceptors and battleships at speed  im in position."
4/22/2008,"heavy group warp to recon1 range 50. broadswords switch to area warp disruption and bubble on arrival. primary target raven class a, secondary b. falcon group jam that scorpion and watch scan for enemy reinforcements. interceptors weapons free i want space superiority.committed and now it was the killing time, at close range we'll make short work of the ravens and scorpion and our ew superiority will keep additional unknowns from playing a role before its too late. we have initiative and thats half the battle.30secs to contact: this is how it is, all across the contested battlezones of 0.0, cat and mouse, desperate gambles, recon and commitment, intelligence and scan officers searching for foes, evading patrols, locating prey or trying their best to slip between the nets of territorial claim and sovereign hegemony on the frontier. transition to real space and targets flashing red in the void  the assessment is calm now, weapon locks acquired and firepower delivered. in close proximity to the fleet the ew recons decloak and their systems swing the battle fully to our favour and for a sweet minute the sense of fulfillment and victory is everything.additional contacts inbound  4 battleship hullswhere did they come from? (no panic, not now) unknown.recon element is picking up a cynosaural field beacon at 2au range from fleet positionthe words are like a gunshot in a prison yard.broadswords de-activate disruption fields, fleet align for the star, recon1 give me a safe enroute to stellar primary.roger thatslowly the fleet comes around with weapons still flashing against the second ravens failing shields as the wreck of its twin tumbles and sparkles in the interstellar night and the scorpion makes microwarp speed away with its own systems comprehensively jammed by our electronic superiority.what have i forgotten?(all around us at 40k removed the electronic distortion of disengaging cloaks to reveal 4 sabre class light interdiction vessels and the flares of their drive units on intercept course.)new contact, thanatos class carrier confirmed at 2au removewarp drive inactive, were bubbled.new contacts, visual, 4 additional raven class battleshipsclosing my eyes momentarily, just a second thats all it takes. all ceptors to our position and eliminate the sabres, group maintain alignment, ew spread on incoming battleships, broadswords get ready to fight. now were in for a rough ride ***the above little story is fiction. its not about eve as it is now, but its about eve as it could be if we get to the point where local chat is removed from the game in 0.0 (and perhaps lowsec) and we move to a system where intel-warfare, scanning, and limited knowledge of enemy disposition becomes a factor in space warfare. its a massive change admittedly, at the moment fleet commanders and individuals and tiny skirmish gangs have perfect near perfect knowledge of the population of particular systems. we know that if there are 10 reds in system and 5 reds in the system over then the worst its likely to get in short order in an engagement is 15 against us. if local blooms from 10 to 15 it means an active enemy gang has jumped in and we can react accordingly but the question is -> is this reasonable intelligence for us too have, and is the game better or worse for the existence of this intelligence-gathering tool?at the moment everyone from the biggest territorial alliance to the tiniest pirate outfit and even lone-miners and ratters have scouts in the systems around them, perfect views of population, perfect knowledge when enemy gangs come. with the advent of tools like bacon (which i obviously hope does get ruled against eula) this situation becomes even more weighted and it becomes literally impossible to surprise anyone without a hot-drop of some kind."
