4/25/2008,"i believe in the long run getting rid of local would create more problems then it solves. while there are some inherent issues with it overall it's such an ingrained part of the game now i think it would be difficult to replace.i look at my own experiences in 0.0 space in survival mode (and as someone who has played this game solo at times). i jump into a system. i'm cloaked initially but unless the pirate gatecamp is at that gate i really have no warning. am i supposed to stop and probe out every system i'm jumping thru on my way somewhere? not realistic and way to time consuming we might as well just get rid of highways. after all i remember 84 jump trips before those came in (and before ap). now it'll take just as long to go 20 when we have to scan people out.likewise now when i jump in i can see local, see those orange skulls and think ""hey there are pirates around here"". maybe i'll scout a bit, warp in at 100km to a gate or warp to a safe location before doing anything. i have the choice to protect myself. without local you're fair game.i completely agree with hardin on this one. while local isn't always the greatest it is the way we've played for years and moreso it's the way many have stayed alive (or at least less-dead) for years. another point is what i would think would be a decline in combat. right now generally two evenly matched fleets will engage. sure one side likes the advantage but usually if the fleets are close it's ""hey lets rumble"". now imagine where you have no idea what the other fleet has. right now you can send scouts to other systems to see if reinforcements are there or check the map for pilots in space. not anymore. i see gank gank gank the end result of doing away with local. i just don't believe it's realistic and furthermore believe it would decrease the pvp opportunties in eve for 0.0 dwellers to a point where the game could lose interest to them. even with a ""sonar"" type of scanner if you can't see the opposite gate your warping to you're completely blind. i'm sorry but if i'm in a system and i see 20 pirates in local i'm going to take precautions. with this model the only precaution i have is making sure my clone is updated.while archbishop is in a corp i do play solo alt characters at times in 0.0 space and i know if something like this went through as a solo player i'd be back hiding in empire. stuff where fleets of alliance mates can drum up 50 ships is fine but for the solo or small corp player it's completely unrealistic. right now those solo an small corp players have a life in 0.0 and local is one of the only real ways they have to protect themselves. taken away it's gone regardless of what type of scanner you get. people want some semblence of security and like it or not there are a sizeable number of eve players who are solo or in small corps. i can see them moving back to empire because of something like this after being ganked over and over again by unseen gatecamps. i don't think thats what ccp wants.archbishop"
4/25/2008,"it's the eternal question of eve:do you want things safe or do you want them interesting?local is the 'safe' thing right now. people are used to it and it provides them with near perfect information.if you remove local, no matter what you replace it with, you will create a period of 'interesting' where old assumptions mustbe abandoned and new tactics developed."
4/25/2008,"well, this is the thread i was thinking of:"
4/25/2008,"i must admit straight away, that i have only skimmed some of the posts (and ignored most) as i simply dont currently have the time to give this topic all the attention it requires right now.i agree with the main arguments against removing local in that it would move the game balance quite drastically towards favoring the attacker. i won't go into all that again - it has already been covered. however, i do see the general frustration with local, and perhaps it's possible to come up with some sort of ""middle way""?so here's an idea that might be good or bad: imagine local is ""updated"" by either having people using gates into the system, taking aggressive action or flying capitals.also, imagine a module coming in 3 sizes (frig, cruiser and bs). this module would have a rather high cpu and power requirement limiting the striking capability of the ship it's fitted to, but it would allow you to jump to planets and stars within range without using either gates, jumpbridges or cynos.the range is could then be 0.3 light years per rank of some skill invented for the purpose.finally this module would have some restrictions on use: you can't fit a cloak on the same ship as this module and you can't activate the module for a period of 30 minutes after taking aggressive action.the idea of this being to give raiders some sort of ""first strike/surprise"" capability - but at a cost. after attacking you can't cloak or use this ""supercyno"" module for an extended period of time, making you somewhat vulnerable to the defensive response.personally, i would also like to see the logoffski trick hampered by letting ships fitted with this module remain in space for 30 minutes after logoff (me no like logoffskis).i haven't exactly thought this one through, but the idea might be worth some consideration."
4/25/2008,i am tired of saying it all over again but:local needs to die (without replacement)buff the scannerthats it... repeat that for 5 years ... and here we are ... sad isnt it???ccp utterly failed on instas removement so i hardly see anything cool coming out of this change.
4/25/2008,"hat off to you, sir!a very nice post and damn solid arguments.count me amongst the supporters."
4/25/2008,"thank you sinnae, very much appreciated."
4/26/2008,"if those advocating the removal of local would answer a couple of quick questions from me it would allow everyone to make a more informed decision. for many years now we've seen ccp make some decisions to change the game only to have a patch a short while later to ""fix"" some ""unintended consequence"" of their ""improvement"". 1. if local is removed how are solo players who operate in 0.0 supposed to live there anymore and enjoy the benefits of 0.0 space while staying as solo players? given the increased risk of ganking when you warp into a gate and have no idea if someone is there or not (like a 30 ship pirate blob) i would think the enjoyment of the game by these solo players would be greatley diminished. i also think they would flee back to empire where they can ""see"" whats around them.2. on long distance trips thru 0.0 space are you supposed to stop and ""scan"" the system now everytime you jump with some new ""sonar module"" sort of thing? how long would this take? it basically ends autopilot if you have to stop everytime you jump and do this.jade's idea is great if we want to change this into eve-alliance-online and have everyone join an alliance so we can all fly around in a battlegroup and scan out the enemy. the reality is far different for many in eve however and i don't believe making changes to the game which basically lead the solo players to the altar of sacrifice and gankarmageddon is the answer. not everyone is in an alliance and can do these things. likewise even if people are in an alliance maybe they're not some battle hungry alliance of pvp killers. maybe they're peaceful mining industrialist carebears venturing into 0.0 to make their fortune. not everyone in eve is looking for endless pvp and ""wild times"".while something like that may not be intended by removing local i do believe it would be another in the long line of ""unintended consequences"" to ccp patches and ""improvements"". those two questions above stand for anyone willing to take a shot at them. if a compelling argument can be made i'll listen. but i'm going on the experience of someone with nearly 6 years in eve counting beta who has played the solo game in 0.0 and knows the reality of ""flying alone out there"". now there is something that no one has brought up however (that surprises me). what if in 0.0 space any war declared enemy doesnt appear in local? you can see everyone else (like those 15 guys with -10.0 sec status) but if you're corporation is wardec'd you can't see those enemies. i mean if people want the thrill of the hunt and chase why not this? it gives that hunt and chase to those who want it while keeping the status quo for those who don't.even so i do see something like this causing pvp to slow down quite a bit as corps are reduced to ""scanning and jumping... scanning and jumping"" to accomplish anything. sounds kind of boring to me.archbishop"
4/26/2008,"some of these issues have definitely been addressed in this thread already archbishop but just to provide a decent summary to your points: 1. the removal of local will not really change the solo dynamic negatively in 0.0. at the moment lone-players dont really move with perfect freedom archie. sure you can warp to outbound - but each time you jump through the gate you take the same risk you outline for the local-less scenario. how do you know you arent jumping through into a sensor-boosted / hic/rapier camp? you dont, thats eve. how do you escape? well, speed, cloaks, ew? maneuverability. pretty much the same evasion tools you'd need now if you jump to a gate and get caught by a bubble off gate. only difference is that when warping to an outbound you can opt to go to scan point and check first. when jumping through a gate you don't have that option (and that is the current status quo).at least with the scenario you outline (warping to a gate) you have an option of moving with scanner open and being pre-warned (or warping to close celestial and checking)  or if its a common route for you then by all means make a line of in-line scan points 1000 klicks or so form the outbound and be warned of the gate status. doing this gives you more information and warning than the process of simply jumping through the gate without scout does now.2. if you read the suggestion were talking about a new form of long range scanner that is always on and can be configured to give proximity warnings on the acquisition of new contacts. yes of course, going to outbound scanpoints as a precaution would break your autopilot but seriously, who uses autopilot in 0.0 archbishop?3. i dont think your previous points support this concept turning eve into alliance online  on the contrary i believe that reducing the perfect map intelligence and local monitoring functionality will reduce the ability of alliances to control and dominate space and will allow solo/small group players far greater opportunity to evade and exist in 0.0 without continual interference from sitting powers. at the moment any ratting/mining op can be seen by everyone in eve by scanning the map. discovering the presence of interlopers is ridiculously easy just by scanning through local with a quick trip. reduce intelligence functionality and you are making it easy for the little guy to evade notice and isn't that really what you were worried about?anyway, thanks for your comments archbishop and i hope you'll read the feedback to your points with an open mind.all the best."
4/26/2008,good writeup.
4/26/2008,"something that hardin wrote caught my attention here.to paraphrase he noted that less information equated to a less safe environment - the options then being to stay in a safe area, or to seek safety in numbers: thus reducing the viability of 'solo' play.its a sound argument in that respect, which might point us towards solutions.i know ive mentioned the aspect of 'terrain' in terms of system space as an important factor, but ill detract on this for a minute and talk about concentration of force.if we think of the scanner perhaps it should detect not just individual elements (such as ships) but the combined effect of large numbers of ships in one location. for example, the scanner might act to detect 'mass signature' readings created by ships in close proximity to one another.in essence the scanner would actually show blobs as, well blobs of mass on ""radar"". this might be fairly simple to calculate by totaling the signature radius of all ships within a given grid for example.now, to bring back my thoughts on 'terrain' we can then add an overlay of backround noise and interferance around certain objects / environments in space. where this background noise is strong individual ships would be lost amongst the clutter but larger ships / 'blobs' of ships would still be apparent.furthering this subject we can consider the popular 'active vs passive' scanning method. here we might imagine an active 'ping' clearing away a certain amount of background noise (albiet at the cost of a higher signature radius) within a narrow arc of view and range.even more tantalising we can see the prospect of 'camoflaging' your ship for specific environments through the use of specialised modules, or the creation of probes that produce false images of high mass concetrations.edit: visual representationany thoughts on this?c."
4/26/2008,"do you ever log in, jade?"
4/26/2008,"mmmhmmm, but generally quite late in the us tz at the moment lavista, i don't often play in the uk tz unless we've got an arranged op. drop me a pm on the sf forums (or shc) if you want to arrange a chat."
4/26/2008,this is a brilliant idea!
4/26/2008,yes it is isnt it - anti blob too when you think about it.c.
4/26/2008,"agreed to a point although lets look at it a moment from the aspect of the stationary solo/small alliance player in a system. lets say the abc mining corp is out mining in 0.0 and has 3-4 mining ships or even a rorqual and 2 guys in ravens to defend against belt rats and they're just minding their own business. with the current local system if 10 pirates jump into system they'll be seen. with no local that warning is gone. sure some proximity sensors might help and the two defending ravens could swap a high end weapon for a ""scanner"" to keep scanning but why then would this be any different from what we have now.that's sort of the point i'm making here. with an improved sensor system it's really no different from current local. people are supporting a revamped sensor and map system to help aid the local ""benefits"" lost yet why even dump local if we're going to offer totally usable substitutes? in the end that's the hidden point of my message. either they'll be big changes or it isn't a change at all and i have to agree with some that ccp doesn't move in big steps. in the end i think the abandonment of 0.0 by alot of solo and small alliance players would happen, i believe we'd see alot more gatecamping and alot more ganking and in the end no real improvement.i do agree with you jade that local was never intended to become an early warning system. that's what's evolved though and thats what we've had for five plus years. while we can tweak it a bit, maybe make it so war declared enemies don't appear or something, in the end i just don't think it's wise to mess with.i will agree with you on dumping the map inteligence. likewise i don't believe the map should be used for intel. maps are for convenience not recon. when i'm driving down the highway and looking at a map it tells me theres a gas station at the next exit but it doesn't give me the price per gallon of gas. yes dump the map intel and while they're at it make the map only informational. things like services are great but info like pilots in system, corp member locations, podkills, etc are only intel based. who gives us that intel? it isn't realistic.that said i'd support an alternative. what if (even without sovereignty) a corporation could deploy ""spy satellites"" that could monitor a system gate? you could only deploy a few of them per corp but you could put them where you believe your enemy is operating. they'd require maintenance and would shut down after awhile. it would require special skills to operate and the benefit would be more ""realistic"" then some all seeing map we can pull up.this would be good. you could detect a 20 ship pirate gatecamp before you warp in on top of them at least.good discussion everyone!archie"
4/26/2008,"this is a good example to work with. with local, the pirate scout jumps in, sees players in system, and starts hunting for them. the mining op sees someone pop into local, and knows something might be up.with a scanner-based system the pirate jumps into system and doesn't know if anyone is there and the mining op doesn't know anyone jumped into system. now the pirate starts searching for pings on his sonar. he gets a hit - but at the same time the mining op gets a ping too, and the game is on. they both have imperfect information.now in your example the mining op would actually do better to station their guards at the stargates leading into the sytem. then when a pirate scout jumps in, they see him, but he still doesn't know where the mining op is located, and the battle becomes a system-wide situation with a front at the stargate while the mining op in the belt has to start making decisions about what action to take, as intel comes in from the front lines.this sort of scenario is just more dynamic and has more possibilities than the current local chat list. it's not that an improved scanner system would be either identical to local or just not as good - it's that an improved scanner has a wider range of dynamic possibilities than local for how intel plays into conflict.your question about ""if local is just getting replaced by something that does the same thing, why bother replacing it?"" is understandable - but the real reason local needs to be replaced is not that intel is bad, it's that it's a static system.imagine eve was a game with a single class of ships that are all fast and powerful. then someone suggests getting rid of that single class of ships and instead introducing some ships that are light and fast but fragile, and other ships that are heavier and well-armored, but slower. the same question you raise could be asked then: ""why take away our ships that do everything if you're just replacing them with two different classes of ships that amount to the same thing?"" the answer is to make the game more dynamic.replacing the static tool of local with a more dynamic tool that can range from being superior to local intel to inferior, depending on how it is used, will make the intel side of eve more dynamic and more fun. that's what i'd like to see happen anyway."
4/27/2008,"id agree here.the current system is akin to being on a flat becalmed lake. the players 'view' is essentially limitless in terms of 'who' is there. however if we add storms, squalls of rain, mist and fog banks to this lake the picture changes and becomes more dynamic and requires more skill as a result.c."
4/27/2008,"but with this example you are showing that you need far more people to do the same op. now i havent mined since '04 so please dont tell me im getting it wrong, im just using it as an example.in the first instance you have a 3-4 miners and 1-2 guards + possibly a hauler or two. thats max 8 people. now if you remove local, you need someone one each gate, and in most average systems thats another two people so we are up to 10 and everyones profits decrease. now someone warps in, the scouts on the gate tell them someone ebil has appeared and they all get to a safe spot.the game has become no more dynamic, the results are the same, accept you have just made the game a little less fun for everyone. 2 people have spent their evenings staring at a star gate, and the miners have made less money because of it. now mineral prices will rise, pirates will start whining that their ships are more expensive...you get my drift."
4/27/2008,"or you introduce another mechanic. a perimeter beacon, spy satellite, call it what you want. but it gets dropped by a member of the mining gang at the star gate. that gang member can now go elsewhere in the system, maybe mine, maybe keep the rats away but he gets an alert as soon as someone enters that gate."
4/27/2008,"existing in 0.0 would indeed require more vigilance without local, i don't deny that. but again, it's as though battleships were great ewar platforms, and then ccp introduces dedicated ewar ships and downgrades the battleships' ewar potential - people might complain that they're just requiring them to have more pilots in a gang in order to use ewar, but creating specializations in the end makes the game better, even if it's more ""work"".if, in our mining op example, having ""eyes"" for the op was something advantageous then maybe recon probes could be changed to act as those 'spy beacons' that max brought up. the mining op could hire a covops pilot to keep probes up covering the gates to passively detect anyone entering the system and give an early warning to the mining op before the pirates know the op even exists."
4/27/2008,"any replacement of local needs to be well worked-out so that it does not shift balance around too much, but nevertheless manages to add excitement to the game for everyone.one more idea for the pile.how about being able to automatically detect certain warp signatures as well, with the chance of your ship detecting it increasing if the ship emitting the signature is heading straight towards you.(makes sense from a science standpoint, warp drive emits ftl particles, if it heads straight to/away from you your scanner will detect abnormal amounts of those particles coming from the same direction)"
4/27/2008,"an interesting idea.a: pirate sits quietly at a belt ready to ambush his prey.b: miner sits at a belt, sees a warp drive spike on scanner - time to flee!= works for both parties. certainly worthy of consideration anke'.c.ps: please someone fix these forums this has taken three attempts just to post a reply!"
4/27/2008,"ive given up... i had a long post and it wouldnt let me post it.edit - now its let me post that, trying to see if i can get the other post posted, i cant be bothered to type it all out again but the gist was:if you do this, then what is the point, you have just removed local, onlt to replace it with something that acts just like local, but requires more effort.whats wrong with more effort you might ask? fun. this is a game, its not a second job. i will draw another comparason within this game. there was talk about people having cyno blockers up 23/7 in every system which ccp didnt like. they were talking about making it having to be refueled every 12 hours or similar.that would have achieved nothing appart from making people feel this is a job rather than a game. it wouldnt have taken the cyno blockers down, it would have just caused the alliances to spend their entire lives fueling it - and making them hate the game for making them do it.removing local will cause the same if you replace it with a time consuming alternative - people will just do that alternative, hate the time consuming nature of it, get bored of eve and play less or leave. (yes thats rather extreme, but im just making my point)if you want to make eve 'harder' remove local entirely. i wont be happy, it think it will be a griefers paradise. however the alternative is to remove local, replace it with a silly time consuming scanner system which will annoy people who will do it to try and stay safe, and nothing will change appart from everyone enjoying themselves less."
4/27/2008,yeah its a pain - do what i do and copy the whole thing before you post it.c.
4/27/2008,"how does the miner know the warp drive spike is not just his hauler coming back to the belt, leaving the belt, a friendly moving through the system, a friendly ratter in another belt.etc etc etc etc."
4/27/2008,"i like jades's ideas on this matter. a lone hunter in say a battleship would have a snowballs chance of getting somewhere out in null space, if he knows his stuff. meanwhile the, smart ratter/miner can hide off the beaten trail and be pretty safe. all the morons in the alliance will be huddled around the 3-4 systems with the best spawns and the best ore. guess where the hunter(s) goes looking first?"
4/27/2008,"csm's take notelocal soulution is simpleanyone in local can warp to anyone with the rules....1. you cannot warp to cov ops, perhaps probe em out with a long delay (which is long enough to catch afk cov ops)2. warping to a non-cov ops cloak ship puts you in grid at a random distace (distance to be balanced on test server)3. you cannot warp to someone in deadspace. probe em out as usual.bingo - local is no longer stupid. if you see someone in local, you can get a fight out of them if its 0.0 rather than the current cloak*** tactics and afk intel bot tactics.also nerfs all isk farmers as well as all intel bots !think about it. whats wrong with warping to anyone in local? nothing and this will remove all nevitive local problems as well."
4/27/2008,"you make a valid point in all honesty but the scenario i posted was is answer to a specific question about miners and what they could do to remain safe. the alternative there was to use either alts or mains dedicated to watching gates.i think we need to peel this back and refocus on why people want to change local. then discuss again encompassing all scenarios. i really do not think there is a one size fits all solution to this. thanks for your point of view, it's extremely valid."
