6/1/2013,"yes. because your original premise is flawed.there is no ""exploit"" or ""abuse"" of the because...- you can't reliably designate people good or bad on a mechanical level. people find ways to be bad without breaking any rules (so there is really no point to putting arbitrary restrictions on bounties).- bounties do [still] mean something both literally and figuratively... it means someone dislikes someone else enough to put a reward up for their destruction and you can get an extra bit of cash for destroying that person (all that is wrong here are your perceptions on what the ""wanted"" sign should mean).- ""good"" and ""bad"" are relative... as is everything else (again... there really is no point to putting arbitrary restrictions on bounties because what you consider a ""stupid"" reason for placing a bounty another person might consider perfectly legitimate).- the merc market is still thriving. check out crime and punishment subforum sometime."
6/1/2013,"so what you're saying is that if i decided anyone who visits jita sucks, and sit there all day handing out bounties, that's not stupid?if i decide that anyone who dares ask for or give help in a help channel sucks and hand out boutnies all day, that's not stupid?if i decide that all forum users are lame and start handing out bounties 'cause i saw their name on the forum, that's not stupid?if i decide that anyone who does not have bounty should get one and start posting bounties on anyone who does not have one, that's not stupid?why is that not stupid?i could go on, but i think you get the idea. a single troll could have an impact on a multitude of players."
6/1/2013,hence this thread and my attempt to have an actual debate about the .(... thanks for the major on your post after i responded to it)
6/1/2013,"to me it'd be stupid... what you believe is none of my business. but i'll still kill the people you placed a bounty on if it's high enough.see above.again... your prerogative (and i have personally done this from time to time).if you have the cash and think your reason is good enough... go for it.everything is relative/subjective.and if a single troll can stir up **** and cause chaos, mayhem, and/or a war by placing bounties everywhere... excellent! more players are interacting and in conflict with one another!"
6/1/2013,your counter argument is reasonable and much appreciated. i will give it some thought.
6/1/2013,"here.your reply implied exactly that and stated i was was incorrect because of that implication. i meant contacting corps directly, as that's how we do things right now.yes and your whole premiss is based on you deciding what is and isn't a 'good' bounty. from this premiss spawned the new contract system, that you are now pushing. it's doesn't have much in the way of details, so i'm asking about it.i was, you avoided answering that question. it was directed at your 'new' contract idea. why would i know about how concord would interact in this system, it's your idea. isn't it down to you to flesh it out?what does it matter? it's not your place to decide that. it's not your place to dictate who can and can't do what with their own isk and the .just because someone picks your ideas apart and asks questions you don't find easy to answer, doesn't make them a troll. that argument, as well as avoiding answering question, is a very weak stance to take. you either have faith in what you are discussing, or you don't.destination skillqueue:- it's like assuming the lions will ignore you in the savannah, if you're small, fat and look helpless."
6/1/2013,"again... incorrect, i was referring to you not comprehending my multiple previous post talking about the mercs and the morph of the discussion of the thread....you only want 'extreme details' so you can pick them apart for flaws without trying to be objective (i am trying to be objective, you're not.). i'm not going to (nor could anyone) come to a 100% viable solution without asking for input. if you see a hole, why not offer a suggestion? failing that, we know you hate my idea. that's fine (most people do). good for you.if you actually read the thread (and this just proves that you didn't (no more responses for you, sorry.)) you could clearly see that this was not my idea, and i made it point to say so, i merely liked the idea. any refinement of details should be done as a combination of ideas from multiple players. no one is going to get anywhere if people can't help others out with refining their ideas. like i said, it is impossible for a single person to come to something 100% viable without asking for (and getting) input.you are. just cause you are on the side of defending the existing system... doesn't mean you aren't deciding. it is the responsibility of the player base, hence this forum.i'm just getting sick of answer things over and over and having to rephrase thing specifically so you can comprehend them. how about before you click post, you click preview and scroll through the thread. just a thought... or do i need to tell you how to use more than one tab in your browser, and what browser to use, and what a tab is?thank you for your time (believe it or not, it is appreciated), though you get no more of mine.why? you proved to me you did not read the entire thread.please refer to post #27. and the following statement""it's your idea. isn't it down to you to flesh it out?"""
6/1/2013,"yes i am aware you had the suggestion from another player, semantics. you've added it to your idea pool. the specific question related to concords involvement in that idea. i would imagined a person with such a high intellect as yours, would have some opinion on whether they would be excluded or not. i guess you are right and comprehension of that intellect was somewhat lacking.it still boils down the the same bad premiss. which is what you have decided is and isn't a good reason for a bounty. i personally don't give a sh*t why people do it, it adds to the game.let me ask you this, although i'm sure you'll avoid it also:would you object to the placement of a bounty, just out of random feelings of spite?destination skillqueue:- it's like assuming the lions will ignore you in the savannah, if you're small, fat and look helpless."
6/1/2013,"spite?people gave me a bounty for many reasons, none because i am bad or was bad to them. some thought my bounty to low so they helped it out. others as a show of support.i doubt any isk in my bounty is spiteful nor did i commit any crimes to achieve it.mmike azariah ----<U+FEFF> <U+FFFD>|(<U+30C4>)/<U+FFFD>"
6/1/2013,"that may be true, but i do have reason to ask him that question. it goes back to when we all had this discussion and i'm interested in his reply.destination skillqueue:- it's like assuming the lions will ignore you in the savannah, if you're small, fat and look helpless."
6/1/2013,"just out of common curtosy, i will reply to you one last time, unless you rather discuss?what do you think about concord intevention if the contract system was allowed to hirer killers?do you even support allowing the contract system to be used to place a bounty on someone? (which i have always wanted to see, i think the contract system could use a few additions. (which i will post in the features & ideas section in the future.))not at all, i just destroyed someone cyno frig just because i can (they had plenty of time to run).i have left my home constellation and now i'm exploring the more dangerous ares of eve in an attempt to better relate to the pirate players.imo the 'because i can' bounties, should not be part of the same system as the ones that get the top pirate players' faces posted on billboards around the universe.also, if a person wants to become the top pirate in the universe. i think they should have to earn it. and wtf! why can i put a bounty on myself? if i had to complain about just one thing, that would be it. it doesn't allow the top pirate pilot to be on the most wanted list. it allows the richest pirate to have his face plastered on the wanted boards if he so chooses."
6/1/2013,well if they would allow for skill respecialization it would atleast need serious consequences.for example if you would like to unlearn skill like mining barge you would be refunded only 50% (or even less) of the skill points you spent learning on it.this would be only way i would maybe allow it.
6/1/2013,"i'm by no means asking for local in null to be changed/removed to match wormhole space, merely pointing out that the current mechanics are the root cause behind both ""afk cloaking"" and hot dropping.so let me get this straight, the ""conditions are so different"" because wormhole players... actively keep their eyes open (via probes and dscan), rather than being lazy and relying on a mechanic that can be devalued / spoofed via afking have fits that are more appropriate for the situations (i.e. not minmaxed pve fits) are ""sufficiently organized"" sounds to me like wormhole players have the right idea then. they know they're not in a little happy safe farm zone."
6/1/2013,whats the risk in looking at the local list to determine who is in system and how many friends they have
6/1/2013,"to be honest this is a very silly idea, boarder lining stupid.what fights are you expecting in a highsec belt? all this does it make it that much easier for gankers to find targets making it easier for them to get an easy kill.once again another idea that only helps one part of the game but hurts the others. mining is tough enough for the people that do it. it pays little, has a ton of risk and the miners dont need something like this to make it worst. this will cause more miners to go switch to something else or worst unsub since they cant pay their plex fees. if less miners are mining that means less ore to buy to build ships. (how i earn my isk) which means less ships on the markets for pvpers. stop trying to make mining worst and maybe submit some ideas that help make it a worthy profession again."
6/1/2013,"i have run several low sec missions and i do agree they mosty suck the pay out isnt worth the risk. but making trade routes go through low sec would never work. the empires patrol those areas and they arent going to give them up anytime soon because that would be a loss of territory. what low sec needs is a reason to be there. fw has plexs that only show up in fw low sec, it gives people a reason to be there. giving some missions for pirate factions would be somthing that could bring people into low sec to run missions to get enough lp for that pirate hull. but low sec as it is its not worth the risk when you can just run missions in high sec then buy the hull.low sec ore is a joke. jaspet is pretty much worthless. its huge, comes in limited amounts and you can make more in the same time mining veld. now if jaspet was the only ore that gave zydrine.... there would be a huge reason to go into low. but you would have to take ore from null and everyone knows you cant touch anything in null sec because its ""end game"" blah blah blah. etcunless ccp is willing to make changes low sec will always be pirate havens and ghost towns.maybe let alliances stick up sov beacons in low. i know its a crazy idea but if you can claim the space your more likely to defend it. fw low sec has tons of fights because people are fighting to hold on to it. it means something to them."
6/1/2013,"highsec is entirely self-sufficient. it's not a closed community because there are things it lacks, and there are things it provides that other places lack.wormhole space will never be a closed gate community because it will always provide tech 3 components to the rest of new eden. don't get me wrong, i don't think that w-space should have anything close to everything available. i think there should be tons of juicy things that you can't get in w-space at all. but that doesn't mean it should not be possible to subsist alone in w-space. it is possible to subsist alone absolutely everywhere else, why not w-space too?"
6/1/2013,"that's why there are static wormholes. you can't cut yourself off. that is what makes eve unique. also, not having to play with other people is sort of an eve online and star wars: the old republic thing. not very many other mmos allow that."
6/1/2013,please link dev blog where it says that empire space is getting refining nerf. spread your fud elsewhere.
6/1/2013,"no dev blog, but there is much talk about equalizing empire because it has too many players and making too munch money.even ccp soundwave mentions in this interview, he thinks are too good."
6/1/2013,"the amount of money made in empire is not what this is about.this is about the fact that every part of new eden has some sort of ice except wormholes. every part of new eden can close its self off and ignore the outside world except wormholes. giving wormholes ice will not break the game, it will not cause the massive power blocks to shift, nor will it cause the all mighty jita to tremble. giving wormholes ice allows players that live in a wormhole to exist there just a slight bit easier. it is a small thing that would make the game alot more fun and go towards cooling tempers. it lets wormhole dwellers provide their own fuel, it gives non combat pilots in alliances something to do while they are inside the wormhole, it gives more targets to shoot at for combat pilots in a wormhole. you dont have to worry about the ice getting brought into empire to hurt the market since compression is terrible and we can only get 75% max yield from our refineries. this idea doesnt hurt anyone but helps alot of people."
6/1/2013,
6/1/2013,
6/1/2013,
6/2/2013,"i endorse the idea of adding our smart filters to the overview and allowing more contextual sorting. if we get to work on the overview in the near future, this would be the kind of thing i would want to do to improve it.i also hope our new ship group icons will eventually make it into the overview, allowing players to read instantly what type of ships are around them. but first we need to make sure they are good enough in a feature that isn't as critical as the overivew. so once we have released them in some way or form and evaluated their usefulness, then i would want to see them used in the tactical overlay and the overiew.ccp arrow | director of user experience | eve online | @ccp_arrow"
6/2/2013,"the ship info panels could be helpful but not if they interrupt quick selection in the overview window.i think the icons for the shiptype we are seeing on the overview should be reworked. the destroyer icon is too large, and they are in general too vague to draw much from.building on a previous picture, it would be nice if the icons depended on the hull size (as they pretty much do currently) but with the added bonus of looking fairly distinctive for each hull size. my mockup isn't that great, but it should be reasonable to illustrate how distinctive each icon on the overview for player ships should be."
6/2/2013,"ccp arrow, please look at this thing : supreme commander strategic iconsthis is a list of strategic icons in the rts supreme commander.this is how it looks like ingame : zoomed out viewas you can see, this is very easy to read. any semi-competent player will notice where the blue defensive line is, what the attacking forces' units are.just imagine, goonswarm's tengus (trapezoids) supported by huginns (diamonds), scimitars (squares) and some interceptors (acute isoceles triangles, because they're fast).now that's easy to read. you can see what their interceptors are going, how the logistics are placed and all that stuff.you can even use supreme commanders' system for tech 1/2 differentiation. add small white tabs under the strategic icons. 0 for tech i, 2 for tech ii, 3 for tech iii.done."
6/2/2013,"why should concord care?as long as ""the rules"" are followed, what reasons capsuleers have for hating one another is none of their concern.then it would be just like the old . get alt to accept a contract and have the alt kill you (and remember that contracts are ""one-off"" things... they have no ""reoccurring"" function). collect bounty and laugh at the person who placed a bounty on you.pro-tip: don't think too hard about it (we certainly don't). most of us put more effort into ""how"" we do things rather than ""why"" (as i've said in previous posts... it's a mentality thing... you either have the urge for destruction or you don't... why you destroy is a drunken rationalization or afterthought at best... ""we don't know him, but i'm pretty sure if we dig through his history we'll find some reason why he had to be blown up!!""). why not? like i said in my last post... what reasons you or i perceive as stupid may not be for another person. you simply don't know (because you are not that person and your values are different from him/her). this very disagreement that we are having is literally proof of that.your opinion that ""because i can bounties"" are not valid is merely that... your opinion. i am perfectly fine if people want bounty everyone for no reason. some people just want to see the world burn.as for ""earning"" infamy... again... there is no way you control that because it's relative/subjective to the person. why people hate a certain person may or may not be different from why other people hate another person.movies have been based on this. hilarious stuff happens. maybe you are bored and just want people to attack you? maybe you hate yourself? who knows?"
6/2/2013,"common courtesy? i think the current system, even if it requires a few tweaks, is fine. the tweaks are around the payout percentage and a few other small changes. i can see the attraction somewhat of contract killing, but the question related to concords interaction with an active contract. yea i do know what i think on this, what are your thoughts?so fine with them, but not to be in the same system as ones you deem appropriate? yea we understand that and we completely disagree with this bad premiss.please refer to posts #17, #26, #37, #39, #46, #48.it's by design and remains how it was before the change. if someone wants to waste that much isk on themselves, so be it. it all adds to the game and promotes more player interaction. why is that not a good thing?destination skillqueue:- it's like assuming the lions will ignore you in the savannah, if you're small, fat and look helpless."
6/2/2013,"how about (read it to the end first) removing local and replacing it by constellation chat? you still have your intel and that somebody is in your constellation, but you won't see how many and who is in your current system.so your intel channel become more valuable too, because you can keep an eye at gates and report the guy/fleet.this!"
6/2/2013,"i have seen this suggested many times. it is a somewhat elegant and easy solution to introduce.my only concerns are that i do feel we have a balance atm. even if this balance is made through two imperfect mechanics off setting each other, but balanced it is. would the change from local to constellation, tip the balance in favour of those cloaked? if this is so, then would we see an introduction of a cloak hunting system? then placing the balance firmly in the other direction?i know i may be over analysing it, but i do see a snowball effect in the offing.still, it is a nice simply change that could be made.destination skillqueue:- it's like assuming the lions will ignore you in the savannah, if you're small, fat and look helpless."
6/2/2013,another aspect: blackops and covert cynos would become much more fun and become a lot more attractive. you wouldn't know in which system they jumped into (unless you tracked the covert ship through all gates and pinned it down to a specific system) and whom they will attack. but it might be too op as well. i don't know. certainly much more interesting. and it would put the null back into the nullsec.
6/2/2013,"i think the difference is that local is a two way street. you see me, i see you. if we are both paying attention then any risk is equal.cloaky: what chance/module/skill does the target (say a miner) have to defend himself aside from scooting to a pos or station? what risk does the afk cloaker take in a safe spot as he leaves for work for the day?mmike azariah ----<U+FEFF> <U+FFFD>|(<U+30C4>)/<U+FFFD>"
6/2/2013,"ok so i consider eve online and what ccp is doing is a wonderful and great thing. the idea of freedom and freemarket in the game is amazing. there is one thing that bothers me though. as we all know the world economy is not in the greatest of shape and the worlds monies are a bit shakey. euro is bound to crash following the dollar. so my question is if the currency on which ccp uses for subscriptions happens to fail what, what is ccp's ?"
6/2/2013,bitcoin!
6/2/2013,[/thread]
6/3/2013,"strike three.i don't like you rolling your eyes at me when i was considerate enough to answer you.the rest of your post, and any and all that come after this post (from you) in this thread, will be ignored. thank you... i mean, bite me."
6/3/2013,"shame you couldn't argue with a decent and respectful attitude. but then it seems bad ideas, tend to come from those with bad manners.oh and i thought i'd leave this little quote for you. (in what can only be described as a redundant thread.)good to know you're still reading my posts though. destination skillqueue:- it's like assuming the lions will ignore you in the savannah, if you're small, fat and look helpless."
6/3/2013,"out of your last 2 posts, i saw the line that i quoted with you rolling your eyes. and the ""good to know you're still reading my post"" (cause it's at the bottom of the thread) i'm not just ignoring you, i'm making it a point not to read your posts (in this thread) as well.do i want to know what it says? kinda. am i gonna read it. f-no!i'll be starting a new thread in features and idea based on some of the things that came out this thread and link them when they are posted.mag's you're not allowed to click them, you have to use the forums search feature"
6/3/2013,"ok, then we don't care to waste time making the same explainations all over again because you think you're a special snowflake.if you want us to put any time into considering your ideas, then you should at minimum put similar effort into making sure that they haven't already been looked at, and into addressing objections raised at that time. if you can't be bothered to do that, why should we be bothered to spend any time on self-serving skillpoint reset proposal #218?(answer: we won't)"
6/3/2013,"the target has the built in mechanics of cloaked players not physically being able to do anything to them while cloaked on their side. they also have the fact that cloaky ships generally have weak tanks and or meager dps.there may not be much (or any) risk for someone sitting afk cloaked - but there's no risk for someone sitting in a pos or outpost either. and like someone afking in a pos/outpost, there's no reward."
6/3/2013,"afk is fine, cloaking is fine, but don't make them invulnerable. give me some way to find and kill them at some point. lets make eve a bit more real. you could hide in my home. i may notice you broke in or hear you moving about. chances are very high that eventually i will find you. you will have time to do dirty deeds until then, but when found, i could turn the tables.special probles, or ship fittings, or even a time activated system wide scanner (anchorable). i'll let someone smarter than me figure that out.at its current state, we need more risk for the system cloaker."
6/3/2013,"this isn't aimed at the op as that focused on actual inactivity from the player bringing up a prompt of if you are afk (which i guess is a reasonable thing). i'm asking this more toward the general dislike of and demand for ways to counter cloaking (i didn't want to start another afk cloak thread either, people would hate me).how do you know they are a cloaked afk player? is it that they don't reply in local or remain in system for hours and you can't scan them down?because i fit into that catergory as an explorer. i fly a cloakable ship, turn local blink off as i'm exploring solo, and spent most of my time using the scanning system. but i can't fit a cyno and my usual explorer fit has little to no offensive and defencive capabilities. i don't like the idea that while i'm focus on scanning down a site and sitting in a safe spot cloaked that someone can still find me and kill me went i've taken the steps to not being found.also, though i'm not sure it will still work after odyssey, can't a covert-ops frigate still avoid you uncloaked at a safe-spot using the eccm method to counter probes?"
6/3/2013,"let's make the comparison a bit more real: instead of somebody in your home, you just have surveillance equipment in your home, watching your every move. i sincerely doubt you will ever notice that it is there. and you won't find everything. in nullsec at least you know somebody is there and watching you. ;)"
6/3/2013,"you make a good point. in order to watch every move you would need a lot of camaras, and a respectable amount of time to install them. as a person very familiar with this type of activity, its not easily done in great numbers undetected. therefore, setting up many cameras in someone elses home for evil intentions is rare, and not everyone can do it. in eve no skill is required to cloak up and hide. even camaras can be found in time, in eve a cloaky cant. there needs to be a chance to counter it, even if its slight. let people cloak and camp, its all good, but don't make it risk free."
6/3/2013,why
