6/5/2013,"this. does it have a limited and niche appeal? yes. are you forced to use it? no. could it be cheaper to get a second account? yes, at around 3 months per char. should it be cheaper than standard pricing to use? hell no. the choice is simple, either use it or don't.destination skillqueue:- it's like assuming the lions will ignore you in the savannah, if you're small, fat and look helpless."
6/5/2013,"it is what it is, invulnerability to gain rewards. afking for rewards and effect is frowned upon in every other aspect of the game. twist it, mold it, and paint it however you want, it seems simple to me. let them be found if they stay too long. add another item to the game to do it, helps the eve economy and adds a cool new aspect of pvp to the game."
6/5/2013,"ok i have several issues with this, firstly: there is no reward. they gain absolutely nothing. they cannot prevent other players doing something, they don't gain any isk or assets, the reward is zero. if you decide to interfere with yourself then that is on you. if you consider that a ""reward"" to the cloaker/afker then... don't give them that reward. simple.secondly, i don't even see the point of the use of the term ""afk"" in these topics. to highlight what i mean, let me present two situations.the classic ""afk cloaker"": sits in a safespot, cloaked, ship is completely stationaryplayer goes to walk the dog, have dinner, work, whateverthe active cloaker:sits in a safespot, cloaked, ship is completely stationaryplayer sits at the computer the entire time, chatting in corp, etc chat channels.to everyone in the system, these two players are exactly the same. they're not scanning or hunting, they're not even moving, they can't be found, etc. the fact people keep harping on about ""afk"" would suggest that they do no wish to impede or punish the second - very much active - type of player. except every single suggestion ever proposed would punish the second type of player, despite the fact that he's active (just not visibly so to the carebears).this suggests to me that people are not in fact attempting to deal with an issue regarding ""afk"" players, because they always suggest things that would hurt the second type of player tooso can we stop with the dishonesty? this isn't about afk players, this is about active players that you want defending from"
6/5/2013,"most of the suggestions favorable to this idea of increasing cloaker risk simply push likely combat areas away from gates and stations (if you assume that unknown situation = pilot avoidance) by making these choke points a weaker choice for campers, cloaked or not.even with the ""constellation-only local"" you're going to have the same issues as you do now - you don't know whats behind that gate or outside the station. the only way to save yourself is with logic, experience and a decent fitting. if this is what you hope to avoid then the issue for you is gameplay itself.this all just boils down to someone being upset that they aren't good enough to avoid easy camping tactics which just equals poor ability. why should eve reward people for being horrible at it?"
6/5/2013,what resources do you propose for the rings?will they be like ice belts and mined out in a given period?mmike azariah ----<U+FEFF> <U+FFFD>|(<U+30C4>)/<U+FFFD>
6/5/2013,"as sentinel zx pointed out to me (here), ccp fozzie said yesterday that ring mining isn't something being worked on anytime soon (if ever).that said. i'd imagine completely new resources for the rings that tie into a new industry (ideally stargate construction), i'm sure existing minerals and ore are there but the ring harvester is looking for only certain types of resources, something that exists in planetary rings only, plus asteroids provide richer yields of those already available ores.scientifically speaking they should contain moon minerals spread across the ring as a fine dust or micro asteroids. but i wouldn't want ring mining to tread on any ones toes so a new resource works better.ideally it would be something like the actinides and other radioactive elements and you'd harvest the decay products (eg. thorium is collected to create radon gas which is then used in some way to aid the long-range jumping effects of stargates, perhaps as a radioactive tracer between the two gates that maintains the connection).there wouldn't be a limitless supply of the resources in rings, but i would see them more like belts, a fixed amount that is respawned after downtime (do belts still work that way?). it certainly wouldn't be like the old ice mining, more like the newer version, yes, but it would take a well run mining operation to deplete a ring within a day.i also imagine that mining the rings in high sec would require something like the 'starbase charters' so that you need permission from the empires to do it, low and null sec (and wormholes) would be free to mine and have greater quantities of resources."
6/5/2013,"if you had attended fanfest and went to the ccp panel on their company growth and outlook for the future, you would already know the answer. but since you didn't some nice soul put it up on youtube right here."
6/5/2013,i would rather use the crappy system the japanese players are forced to use.
6/5/2013,"laughing at this peer pressure pyramid scam, seen a few people fall into it and doesn't look too good .)"
6/5/2013,"not being able to dock would be the best way to balanced.hell, let it even build capitals (not super caps). transporting the mats for it to build those massive of ships would actually be a rather fun logistical challenge, if they are not all from mined material. if you parked it right outside a station, so freighters could undock and dump mats in it would leave it quite vulnerable to attack. much tears, best tears.if you want to further enhance mining game play, give it a doomsday for a comet. basically, you can have comets be like ore sites, where you have to warp in a super industrial to hit it with a drill-ray to brake it into pieces, then others can mine the pieces.of course, like a titan, it should have to sit there for 5-10 mins while using the mega drill-ray. maybe you can even use the hacking mini game to ""cut it into pieces"". mehit wouldn't overhaul the boring mining problem, but it would go a long way to help it."
6/5/2013,"wowi love the idea of a trail of clues but this would be almost an epic arc that demands skills be trained as opposed to an ongoing repeatable process, wouldn't it?m"
6/5/2013,"yeah, i envisioned it as something that requires a little of everything to complete, some projects can be completed within a day and some of the more epic tales and mysteries could be months and years but with the rewards scaling to match (i also like the idea of small groups or solo players needing to drum up support and funding to pursue leads like a desperate scientist pleading that the next stage of his research will yield massive rewards for investors). a solo player could do it but there are lots of skills (new and old) so it doesn't fit a tightly focused character build or specialised alts but is easier for corps and groups to complete with diverse skill sets.i have been meaning to do a mock-up of the discovery codex, which would keep track of projects and also work as an ingame lore encyclopedia, there is a section that shows the branches of a project that would look like the dust skill tree or the ship progress ui shown at this years fanfest.you can follow clues down one path and if you hit a dead-end or something requiring skills that you don't have you can double back down the project tree and follow other clues and different leads. in a corp or group these branching leads can be explored simultaneously and discoveries pooled to refine results and data.really it shouldn't be called archaeology but more investigations but i wanted it to focus on discovering the history of new eden and bring the lore into the game."
6/5/2013,removing the command processor module would reduce the effectiveness of ogb alts
6/5/2013,"well this one is super simple. in the corp information tab there is a piece of information which relates to the corp member size. i think that this piece of information should be expanded in order to include the total amount of members, the amount of eve players, and the amount of dust mercs. this would allow the populations of both games to see if the player corporation is mainly an eve based corporation, a dust based corporation, or if they have a mix of both. -venix"
6/5/2013,
6/5/2013,
6/5/2013,
6/5/2013,
6/5/2013,
6/6/2013,"considering some of us have been playing for a long, long time with the ability to only train one character, adding an option that requires a plex to use at least placates my bittervet rage at ccp making the game ""easier"" by allowing people to ""have more dudes quickly.""be thankful they even put the feature in."
6/6/2013,"well said gunslinger. these threads always seem to be thinly veiled attempts at nerfing all cloakers, using the 'afk people are bad m'kay' excuse.for all the talk of generating 'risk', it all boils down to making nulsec even safer so the zerobears can rat/mine/whatever under the complete safety of local's all seeing eye.jint hikaru - miner / salvager / explorer / spacebum in the beginning the universe was created. this has made a lot of people very angry and been widely regarded as a bad move."
6/6/2013,would the scoot loot be grabbable by anyone? in otherwords would live players gather around bots hoping for the windfalls?m
6/6/2013,if the us dollar and euro collapse more or less at the same time then we have bigger problems than how to pay for a game.
6/6/2013,"canned food and shotguns, where the smart money is."
6/6/2013,"don't forget ammo, ammo is the new currency."
6/6/2013,"so, yesterday i was doing my thing on the forums, and spotted this post.tldr, some mercs from dust were trying to get in contact with eve players who might be interested in their services. however, they apparently had to create an account on eve (trial, from the looks of it), and then post on the newbie section in the hopes that someone would notice the post.is it just me, or does this seem pretty stupid? specifically, the fact that this is supposed to be the eve universe, containing both dust and eve, with integrated chat channels in-game... yet we can't directly post on each others forums?the solution i'm advocating is simple. create a section on the dust forums where we can post, and vice versa. a liason section, if you will. enhanced communication between the two games means more cooperation, which means the links that bind us get used more often. especially going forward, when the cooperation (or lack of it) between the two games might build or destroy empires.this is low-hanging fruit that should be relatively simple to do, i would think, and could have a decent payoff."
6/6/2013,"they're already in our communication channels in-game, this seems like a pretty obvious change to make."
6/6/2013,this seems like a low-cost no-brainer idea to increase involvement between the 2 games.
6/6/2013,good idea. +1
6/6/2013,i've passed this suggestion on to the cpm.
6/6/2013,"also supporting this, greater co-operation between dust & eve players at some basic level is a must i think as dust players get more organised - as they have proven they can do anyway - and look to impact eve."
6/6/2013,as long as it's a section and not a full forum merge +1.
6/6/2013,"confirmed.just as a starship pilot probably doesn't have much interest in giving feedback on ""domination mode"" in dust, i doubt the groundpounders would have much interest in ""missions & complexes"" in eve. unless they played both games, of course, but then the issue's moot."
6/6/2013,endorsed.
6/6/2013,ok warp effect nice but i realy mis the simple loading system done. or undocking station done. thouse whear best part of long trips. now is am i undocking? do i have to wait for anmation to jump sigh. so hear it is petion to all feal the same way please sine to bring back loading bar or a less glamer quick loading thank for support.
6/6/2013,"i rather like the new system. with two exceptions:it would be nice if the undocking animation was a little more obvious. there are red lights flashing, but they're hardly noticable unless you're looking for them, and i don't want to put that much effort into determine whether i'm undocking or not. i wish the game wouldn't take control of my camera when i arrive in a new system. there's not really a reason for it to point anywhere. i understand why it does when you begin the jump, but the ending doesn't make sense."
6/6/2013,"i have been playing eve for a few years now, and i had come to enjoy eve, but lately i have come to have some issues with the updates.1. the amount of updates and patches that are done. i knew eve as one of the few games that did these things twice a year, but now it seems every 2-3 months there is something new i am having to wait to get patched. i understand emergencies, those you can't help at all, or if there is a major glitch, but there is so much more going on lately.2. i don't play for the graphics, but almost every update for about 2 years now has had more graphic changes than substance changes. for example: the new graphics when you jump through a system gate. it lags down my computer greatly and that is on low graphics. it's painful to deal with. or the scan sites, i don't scan i don't care to see more things popping up on the screen and from the people i have spoken to who do scan, they like to do scanning to find, they don't want half the work done for them.3. this is a game that you can't really multitask in, you have to pick a path to go down with everything. i personally was working on the drake to have heavy missiles and all of that, but then less than a year ago everything changed on the drake and heavy missiles, leaving me with 2.5 years of training that i couldn't use and i was back to using frigates, and i still haven't recovered. then as i look through what ships i can use i come to only two options, heavy assaults or cruise missiles on any of the ships. 4. there is so much that needs to be fixed in the substance field, like everything to do with corporations and alliances is a mess under the corporation tab, and the issues with poses is a nightmare, things have gotten better with dust, but it's still not great. but instead of seeing improvements on the substance we see more shiny objects and flashing lights that do nothing but hurt my computer and it's ability to run the game.what happened to the versatility of this game? what happened to the understanding? what happened to the substance?i used to love this game, but now at this point i feel like i am being cheated out of my money for the service i am paying for."
6/6/2013,so you are complaining that the game changes and grows? that its graphics improve with age and animations are added.what are you askin for? that ccp stop changing the game or that they roll back to the good old days?m
6/6/2013,"please re-read. i think you missed what i was pointing out, i clearly posted somethings i would like to see change, and the things i am unhappy with."
6/6/2013,"i don't personally see a list of complaints that the game is growing, but, i do see complaints regarding a constant barrage of unnecessary changes in light of many very needed ones.an example: player owned stations (pos) - these really need a lot of granulation worked into them.and, yes - it would be nice if we could focus on the multitude of issues, and ignore the graphics ""advances"" for a little while. while some of them are neat-looking -- i would much prefer the ability to turn each and every one of them off."
6/6/2013,
6/6/2013,
6/6/2013,
6/7/2013,"thank you, chitsa jason for your help."
6/7/2013,"if you're paying through plex, yes. if you're paying through account management, a year's worth of dct is considerably more expensive than a primary character.no, i don't have to use it. but i'd like to. and whether or not i use it has no bearing on whether or not i can critique the implementation of it. i'm glad they've added utility to the three character slots, but that doesn't change the fact that it's not what it could be -- for players and for ccp.i've never understood the argument of ""it's something, so don't complain"". if you get paid below minimum wage, are you happy with the situation?see above. being forced or not doesn't enter the equation.i'm not arguing for it to be cheaper than standard pricing. i'm saying it's less than a primary character for well over the cost of a primary character. why is buying a second account both better and cheaper than dct?see above. this is never a valid response. i'm not arguing the feature shouldn't exist, i'm not saying i'm unhappy it does. i'm saying the implementation leaves quite a bit to be desired, and there's no reason it shouldn't be much better than it is."
6/7/2013,"dct isn't intended for people to train their character for a year. if you want to do that, you're far better off doing it on a seperate account for a variety of reasons in addition to cost.it's literally meant as a minor flexibility option for people who want a limited alt with a couple of million sp. i know that you're desperately trying to avoid understanding this because you want 1 account to offer the same utility we get from 3 accounts now, but that's the truth of it.stop thinking of dct as in any way competing with alt accounts. it doesn't. it's intended for use profiles that aren't suited at all to multiple accounts. if you want an alt and you're thinking ""man, just having a second account would be way better for what i want this alt for"" then dct isn't intended for that kind of alt, because there's already an option that does what you want.the rest of your argument boils down to ""i want ccp to give me more for less"".dct is as it is, deal with it."
6/7/2013,"the parts you snipped answered the rest.does it have a limited and niche appeal? yes.could it be cheaper to get a second account? yes, at around 3 months per char.destination skillqueue:- it's like assuming the lions will ignore you in the savannah, if you're small, fat and look helpless."
6/7/2013,i also wonder why therers no limitation to the cloaking modules as you can run it forever but i do support this. seems to make sense to me.
6/7/2013,"gunslinger actually failed to mention the third type of 'passive' cloaker: cloaky eyes/ears in w-space. sometimes one has to sit cloaked off a wormhole or starbase for hours to set up a trap, act as a picket for incoming hostiles, or because the inhabitants of your static are trying to bore you to death with their posspinning."
6/7/2013,"i hope i'm posting this in the right forum and the csm council will take this seriously given the potential gravity of the situation. the problem is as stated in the topic and ccp appears to be completely ignoring the issue. major antivirus software vendors have started flagging the in game browser as an identity theft risk because it's based on a highly vulnerable version of google chrome from 2009there's been a thread on reddit about it, a months old and similar years old threads on the eve issues and bug reporting forum as well as posts i've contributed to."
6/7/2013,"considering that malicious advertisements (malads?) inside legit pages/sites are a thing, this should be a higher priority. furthermore, considering that ddos attacks seem to be a part of the shady side of the eve metagame already (to go with rmt + botting), it is not a far leap to more insidious attack methods."
6/7/2013,"current skill system mechanics are fine. it allows you to try out modules and ships with enough time so that the next time you train your next ""better"" skills you'll be up to the challenge with your next bigger ship. contrary to other silly stupid wow/cod/bf3 games as you can use the best frigging gun in the world and be rambo...here it doesnt work that way. it needs time...and lots of it to become better with your ship and equipement... use that time efficiently.not supported"
6/7/2013,it was just a thought
6/7/2013,i agree.
6/7/2013,agree
6/7/2013,this is what i read here:
6/7/2013,"can we have an option to turn off gate jump animations please, it gives me a headache"
6/7/2013,"hay guys thank you so much for your posts, i would just be so glad if ccp thinking on it a lot more if they done this sort the warp animations and station undocking. to sort out station loading may be put in a cut sean showing you undocking. and as for the jump effect keep it but removed the bit wear the cramer spins around after you enter system."
6/7/2013,
6/8/2013,i would pay to resculpt all six of my characters for more boobage/physics.
6/8/2013,"oh god. the guy in the top left looks like he's ready to get down, but he's not taking his goggles off. lol'd."
6/8/2013,"so, to clarify my point of view:multiclient - its allowed by ccp and its fine by me.multibox software - i dont like it but its allowed by ccp.""translate/repeat keyboard/mouse commands to multiple clients"" - this is absolutely shameful ! i dont care what other games or ccp think about it,i will never embrace it ! ! !"
6/8/2013,"i do not at all want to be given more for less. what i am, is unsure as to why ccp expects me to be happy giving more to receive less.my question is why? there is no reason dct can't be everything multiple accounts is, minus the ability to actually fly both characters at once.and ""deal with it"" isn't an appropriate response to anything. should people have ""dealt with it"" rather than turn ccp around with the jita riots and the mass exodus of subscribers? eve is decidedly better for that, for people wanting the situation to improve. dct can be more than it is, and there doesn't seem to be a good reason why it isn't already.if i'm mistaken, i apologize, but your position seems to be: this is the current state, and any change is bad, no matter what the quality of the current state is, or what the change would be toward.you say dct isn't meant to be the equal of multiple accounts, but why? what, at all, would it take away from if they were more equal?"
6/8/2013,"it's all very simple. this system works well for a very few and limited situations. it in no way is meant to replace second accounts and at no point do ccp suggest it does. it's purely to train alts without having to start a second account and then transfer that char. it's financial viability only last for 3 months per char, then at that point a second account would be cheaper.why on earth should they be concerned with whether you are happy or not, when the system is as described and you are not being forced to use it? i could understand this argument, if they had removed the option to have a second account. but they haven't.so the choice remains firmly in your hands. use it, or don't use it.the list once more, for clarification.does it have a limited and niche appeal? yes.are you forced to use it? no.could it be cheaper to get a second account? yes, at around 3 months per char.should it be cheaper than standard pricing to use? hell no.destination skillqueue:- it's like assuming the lions will ignore you in the savannah, if you're small, fat and look helpless."
6/8/2013,i am not averse to making changes to cloaking but the above argument is weak unless you want to also apply it to active hardeners and damage control and the like.mmike azariah ----<U+FEFF> <U+FFFD>|(<U+30C4>)/<U+FFFD>
6/8/2013,"when a cloak is active, it shuts down all module activation. then there is the sensor recalibration time, as well as the fact you cannot target anyone whilst cloaked.the none covert versions also stop your ship warping, as well as affect ship speeds.if they are not limitations, then what are?destination skillqueue:- it's like assuming the lions will ignore you in the savannah, if you're small, fat and look helpless."
6/8/2013,"it has been interesting playing since odyssey, and watching for the impacts of the heralded re-balancing of ice, ore, and moon goo.what is my verdict?utter, total, and complete failure. why?these changes were obviously designed to encourage players to explore more, and to play in nullsec. these changes could make you very rich as a miner in nullsec! ... on paper.actually, all of these changes fail to address one single, basic point, of the reality of nullsec.the map.the current map in eve has a number of critical choke points in it. both into lowsec, into nullsec, and jump routes needed to access entire regions in nullsec. and guess what - those choke points are all closed to explorers. indeed some are closed to everyone who isn't a plex billionaire who paid for admission to the inner circle of the two or three mega corps that control the critical access points, like pandemic leigon, goons etc.so until the map is changed, nullsec will remain dead and empty. to far to go, to hard to live there. impossible to export things to hgihsec to sell. so all the changes in one word add up to .... fail.fix the map, or stop pretending that things like make ice scarcer do more than making botters make more isk faster.how should the map be changed? highsec empire incursions. each player faction should be able to place sbus, and attack nullsec systems - if claimed and retained for 7 days, the nulls system should change to empire space, with a dev assigned security rating. if null sec mega corps keep null empty, and they have been and clearly indend to continue that, then enough already. add highsec patches in nullsec, with jump gates to the core systems."
