8/4/2014,+1 ive died because of this
8/4/2014,"if you're actively playing the game you're not going to need this because you can see it's full. if you're not actively playing you have bigger problems, like the fact that you're begging to be asploded because you're not paying attention."
8/4/2014,lost it. was thinking the same thing.
8/4/2014,"if you are fitting a ship to do exploration and also want to pvp, then just fit it for pvp, replace the scram with your chosen exploration modules an huzzah, you are ready to go. sure, they will be able to warp away, but then that's the price you pay for also being able to pve with the same build.and exploration is new player friendly. exploration while dual fit to run competent pvp is not so new player friendly."
8/4/2014,"a scram or point/web does more in a fight than just ensuring the other party does not warp away. for most frigate fights, range dictation is critical. giving up range dictation means the chances of a win are extremely low, and as you said, even if things do still go your way, the enemy can just warp off. so you have little to no chances of winning the dps race, and even if you do, you won't get the kill. that is nothing to huzzah about in my book. extra modules that gimp your ship's pvp ability are not required for fw site farming. and fw is the most successful mix of pvp and pve in the game. why should they be required for exploration? ccp should do away with pvp-useless mids and fold them into either the ship hull attributes or into pvp mids. for some reason this game feels we should offer ourselves up as hobbled sheep if we want to explore outside of high sec."
8/4/2014,"because exploration isn't pvp. why can't fleets of exhumers strip mine the hull off of aggressors? in this game you have to make choices when you fit your ship. if you want something fully competent in pvp, then do pvp. if you want to do pve as well, then you have to accept that you have to make decisions that will reduce your pvp effectiveness. it doesn't mean you wont win any fight if you need to, but it means you won't be able to leap into any battle with the same level of readiness.choice is a good thing to have, and we shouldn't take that away by creating more ways for people to do everything at once.edit: and 1 module off the mids isn't making you ""hobbled sheep"". it makes you less effective, sure, but it certainly doesn't make you defenseless."
8/4/2014,"so i thought that this would have come up already since the kronos release, but the last thread i could find was from 2012 (reference: old thread)it would be nice to be able to toggle between preset/saved broadcast settings vs doing them on the fly in the middle of a fight. this mainly applies to hot swapping logistics and dps ships and implementation could range from drop downs to toggle buttons, whatever is easier. this isn't a big request afaik but would be a nice tweak to the changes from kronos."
8/4/2014,i always forget to check the settings are correct until the moment before the fight :s
8/4/2014,yup and then you're stuck following overview if you're set wrong
8/4/2014,i agree. however the some of the drones need an overhaul on their speed. for example web light drones go so slow. a bit hard for a webbing drone to keep with a nano cruiser or a frigate.
8/4/2014,thread closed due to heavy off topic posting and attacks.
8/5/2014,"another bump, as the sov thread in f and i is still going strong. thanks for the read"
8/5/2014,"i disagree wholeheartedly. exploration in low sec and null sec is pvp because jumping a ship into low or null is pvp. even if your only goal is to avoid getting shot down by other players it's still pvp. technically, just undocking in high sec is pvp as well. you can have a large mining op with multiple ships, which implies multiple pilots, which means some of those players could be tasked with security. however, exploration is a solo activity. bringing 2 ships in and splitting the (already minimal) loot between two pilots would be unrealistic. does anyone do this? requiring a pirate frig at an absolute minimum to protect yourself from even a single pvp-fit t1 frigate is exclusionary, and screws with the isk/reward ratio. right now, newer players wishing to venture into low or null for exploration face two choices: 1) fly more than they can afford to lose or; 2) bring a ship that literally any properly fit solo t1 frigate should be able to trounce. if ccp wants new players to have fun and go exploring in low/null then they shouldn't require them to gimp their frigate before heading into ""dangerous territory."" isn't that exactly when you want to arm up? instead, they strip down, and put on a module that serves no purpose toward a ship's defensive or offensive capabilities. isn't it enough of a disadvantage to have them distracted by the hacking mini-game and having to haul a probe scanner? do we really need to strip them of 1, 2, or even 3 mid-slots (data analyzer, relic analyzer, cargo scanner) on top of that as the price of admission for engaging in exploration?"
8/5/2014,"basically, what you want to do is have two advantages on the ship for no disadvantage.you want to be viable in pvp.you want to be able to do exploration sites.seriously? dude, give it a rest. you want to do exploration sites as an alternative money source? fine, that means you'll gimp your pvp fit as opposed to people having un-gimped fits which doesn't allow them to earn isk via exploration."
8/5/2014,o look this thread again.
8/5/2014,"your idea is terrible. it's so simple to just create a corp with just your own characters in it. hell i did that for a while when i started playing this game. ccp cannot possibly monitor this. regardless of what happens with multiboxing software (which will be nothing because this debate has been going for years, and nothing ever happens), there is no way for them to actually monitor and enforce something like this.just move on from the fact that multiboxers exist. it's not that a big a deal really. if your system's belts are getting chewed up by a multiboxer, move on to another system. gank them. do anything except whine about it."
8/5/2014,"give it a rest already. stop with these sensless threads about multiboxing. it's a big universe, nobody is forcing you to stay in ammamake all your life."
8/6/2014,"the problem i have with mulitboxing and isboxer it gives players an advantage, and that advantage is clear when we think of how they are using the accounts.a few things are taken for granted when we are talking about gaining an advantage: (many senarios can be concocted to legitimize the use of this type of gameplay i suppose)all isk or ores from any character that is not the main account is sent to the main account and assets across all accounts are assumed property of the main account. i.e. this is not someone roleplaying with 2+ accounts and treating them seperatly.isk generated is used to make the life of one highly skilled pilot, known as the main, much easier than the game was intended to be and much easier than anyone not using isboxer.did you know a 10 char multiboxer can afford to lose a 2bn isk carrier ever 6 hours of mining at only 35m per hour.this didn't have to be done i created a spreadsheet just to show how one human can take advantage of eve's economy by multiboxing. ive set it up so you can see how much advantage they can get per character up to 10.screenshot of spreadsheetif you want to play with the numbers to see how much you can make with other factors u can get the spreadsheet heregoogledrive spreadsheeti like how 1 guy mining at a moderate rate at only 4 hours a day can net over 30bn isk each month. i think im gonna give this multiboxing a try"
8/6/2014,your spreadsheet is awful for many reasons. the primary being you're not going to make a solid 35 mill an hour across all characters for 6 hours straight in highsec (not even ice miners pull in 35m an hour solid). if you're not in highsec then there's a lot more things you could be doing to make better isk per hour on one character. last time i played in whs and such i was approaching 500m an hour with two accounts. are you going to demand that whs and null be nerfed now?you should give multiboxing a try. you'll quickly find out your theoretical income is absolutely ridiculously overly optimistic..make sure to say hi to the gankers when they come.
8/6/2014,"i am not demanding anything be changed as i like the game as it is.here is some crappy highsec income for ya.nuf saidi don't need to try it as i know people that use it and 35m/hr came from them and is a standard 0.0 anomoly mining income for a t2 mackinaw pilot with fleet boosts using t1 strippers. about 1600m3 per 88 seconds.as far as wh, i dont know about that and yes there is many other things you can do to make more isk per hour.i know ratting can net u 90m a hour easy in a carrier and military 5 index with only 1 char.as to my spreadsheet being crappy. haha yea prob a bit yea, i didn't go to spreadsheet design school so sry for that.ganking yes thats a real threat but is easily paief for with just another hour of mining each day.we can assume if your putting enough effort to multibox eve you can be most likely expected to be putting in more than 1 or 2 hours a day doing ""your thing""."
8/6/2014,"there is nothing scientific or factual with that spreadsheet screenshot. you might as well put in random numbers.you're running fleet boosters yet you neglect to include them in your account total. you present this as an easy possible income rate for all yet you're using numbers from a nullsec anom. you're not accounting for the rent or other costs of keeping said nullsec anomaly either. you're like the industry type that doesn't take into account the worth of the minerals they used because they mined them ""for free"". meanwhile in highsec your numbers are wildly better then the average miner could ever hope for and you will find gankers in in most systems with good ice or ore. granted most of the gankers do tend to rotate across several systems so it's possible to avoid them if you move enough.edit : i just wanted to get it clarified that your numbers are bad."
8/6/2014,"it is very simple to trace commands from one ip over several accounts and compare the timestamps for that commands on the server. the argument about the lost accounts was also made years back when ccp ignored boting more or less and ignored tons of petitions that i and others did about a 0.3 system called ingunn with like 200 l4 distribution mission bots in it(yes we did petition them, we killed them for hours, we made vids about them, we seen ccp staff in polarises around taking a look on the system and it took over a year to swing the ban hammer). plex prices went down big time after it and the player count did stabilize and grow back to the old value over time after the big ban.ccp always will try to allow something that gives more revenue till a point where it becomes a problem or better put more and more people become aware of it and notice it as a problem. it was one thing having a couple of bots in the drone region farming in ravens where 1-2 people pass by during the day, it is a different one having 200 in front of you every day, it is a different thing if there where some people using it in whs compared to having often more is boxed vg fleets in high sec incs than real player fleets right in front of you. it is again a difference between a couple of hulks mining somewhere in a 0.0 dead end and seeing like 50 skiffs at a gate or station in high sec, all with the same name + a number. same goes for pvp applications, where is boxed bomber or gank fleets become more and more common instead of being the exception.in the end, there will be one day when ccp will disallow the usage, people will sell off a couple of chars and everybody will look back a few months later at the game and agree that it was a change for the better and ccp should have probably taken the step rather sooner than later. same as with the bots, at one point you will rather lose a limb than damage your game further and it is not that every single account is lost forever, most people will simply downsize a bit and others will reactivate a few old accounts with the lower plex price so the drop will be a lot less heavy as you think, similar to how it was back then with the bot banning."
8/6/2014,"i just want to clarify your complete argument is bad.my numbers are easily achieveable with a small time of training. your idea and re-refferenceing that highsec is such low income doesnt really matter much as the people not making that type of income prob arent multiboxing. you seem to be a very uninformed player and/or just a time wasting troll. you say ""you're running fleet boosters yet you neglect to include them in your account total."" are you talking about heavy water usage? why include such small expenses? u can run 8 hours a day easy for only a few hundred million a month.i do not count the cost of the toilet paper i'll use in a few hours into the meal i'm eating now.with all your question/comments only leading away from the obvious point that really can only be argued with nonsense, ill let you ""insert your awful comments below""."
8/6/2014,"otlichnick wrote:did you know a 10 char multiboxer can afford to lose a 2bn isk carrier ever 6 hours of mining at only 35m per hour.this is the flaw that invalidates all that work you put into your argument, and every other anti-isboxer argument i've seen.eula states that there shall be no advantage given to any account. nowhere does it say anything about advantages given to players. until you can differentiate between the two, you won't be able to form a valid argument.on a side note, i recently tried isboxer to manage two of my accounts and found the setup time each time i used it and the issues i have with desyncing actually caused my income to drop, so i stopped using it. the slow, plodding method i had to use was far slower."
8/6/2014,"some issues:-when you're running your accounts in their own virtual environment its a small step to have each use a different proxy. isboxer users already pay for their tool, so it's likely they'd be willing to put the additional money for dedicated proxy slots on the table.-large number of people using the same proxy would result in large comparison overhead, opening the door for all kind of node killing shenanigans...-online games will rarely process all commands on the server side but rather will compute the effect client sided and send the results of the commands to the server. the server will then perform a sanity/consistency check. this is why stuff like speed hacks etc. exists; the client sends updated positions that are wrong but set up in a way that fools the sanity check on the server. i'm not familiar with the details of eve i/o, however to just assume that the client sends something along the lines of ""player pushed button x at time y"" seems unlikely.so no, it's not simple."
8/6/2014,the hot dropping community loves you.
8/6/2014,"please clarify how flying a frigate is not ""playing normally"". are the controls different for frigates? they seemed normal last time i flew one."
8/6/2014,"i fly logi all the time. this may help you though as a meantime work around, link"
8/6/2014,
8/7/2014,"simple in theory hard in reality. setting up the system to track every single button press and compare every single button press on every single account in existence would suck up so much server power that every system would be in tidi constantly. even if you limited those comparisons to just accounts with matching ips you'd still have massive overhead from isps with nas setups, apartments, condos, dorms, schools, etcetcetc..plex prices never dropped big time after a banning ever. just a quick look at the history of plex prices confirms my statement. small time of training? you're saying getting into perfect mackinaws with perfect refining skills while being able to setup a pos, have a rorqual, have a jump freighter and rent a nullsec block is a ""small time of training"".. you say my argument is bad but your numbers are awful. you're ignoring the usage of booster characters. you're ignoring time spent moving product to market (including the character training time required). you're ignoring rent costs. you're ignoring all kinds of time and isk sinks involved with getting the income in your spreadsheet.i'm talking about training time for characters. costs of ships costs of structures and the costs of running the boost. you're all like but brah you can get a carrier in like 6 hours with 5 characters!!!! while ignoring the booster alt(s) and the other stuff going on.this highlights your lack of seriousness more then any other statement here. rent costs are not toilet paper. jump freighter costs are not toilet paper. pos costs are not toilet paper. booster/jf account costs are not toilet paper. i can keep going but if you haven't gotten the point by now then there's really no hope in you seeing why your numbers are awful."
8/7/2014,+1. i disagree on the point regarding the super capitals. super capitals are an issue period. unfortunately dread blobbing or dropping your own supers is the the only way to kill a super at the moment. minus of course tackle being hic. this leaves ccp to 
8/7/2014,"prior to writing this thread, i had no idea how faction warfare sov fights went. as i read through fw info, i realized how easy it would be to implement the same idea, just with different structures, timers, and multipliers. thanks for the read (all 5 pages of it!!!)"
8/7/2014,"well, thats the point and this is actual contest between hunter and its pray. if pray stays vigilant and see a warning sign in time, than she will be ok. thats still implies you will have to press dscan all the time, while cloacker still can safely stay in passive afk mode indefinetly. that means pressing dscan, like, for hours, in any system you will see someone in local, but not in dscan. this thing is tedious, i mean, sometimes you will be distracted, sometimes you will just forget. thus cloaker will preserve his role of hunter waiting for careless enough victim. and you still can disrupt your enemy's activities, like, demonstratively going into active mode conveying to all who cares that the system is now under your and your friends' control. so they will either will have to look for cover, or will gather some meeting party and cloakers will get some content, which - as it's usually claimed - they are actually after.you probably missed this piece - according to this idea, dscan never will tell you direction or distance to cloaking ship, there will only be some additional indicator which will light up when there is cloacking vessel in active mode in d-scan range. usual techniques, like narrow-beaming, won't work in this case. it will be pretty hard to triangulate it without those in most cases.but in case if you stay at one place in active mode - yes, you will be scanned down. but if you'll be switching spots on regular basis, you'll be mostly safe even while staying in active mode - thats actually what i intended to achive. if cloacker want to really threaten his victims and disrupt all operations in the system, he have to be atk, in active cloaking mode, switching spots to evade cloak-busting scanning equipment.so both these main applications of afk cloaking - disruption of operations and hunting - will still work quite well, but now they require active participation from cloacker to work as intended, and they allow those victims who are vigilant enough to evade being caught - which actually leads to more content for hunters as numbers of those who will just go out and try their best will increase. because, as today, if you don't have big guys backing you up atm (or at all) with their jump drives fired up, and you see some familiar face in local whom you know as 100% cloaked hotdropper, you just safe up and wait, or jc somewhere else. so, no content for hunters, and distruption of operations of any entity smaller than you with no actual effort for other party.edited: but it will be even more intresting contest if ""hunter"" could get some method of checking is his ""pray"" diligently scans her surrounding, or not. like some kind of radar system which registers any dscan attempts in dscan range (dscan probably implies active radar system, so it should radiate some energy that can be registered by other party, lore-wise). so you can wait for some oblivious victim in passive mode, just checking this ""d-scan meter"", or you can study her ""d-scan pressing patterns"" and find some holes in them, in which you could switch to active mode and get her.this new feature could be made available only to ""inherently cloaking"" vessels (and mb even only when they are actually cloacked), like covops, recons etc. so hunter can register each victim's dscan attempt, but victim - can't."
8/7/2014,"actually, i am quite good with this, and i understand perfectly well what you explained in context.the additional burden by needing to d-scan for protective reasons is exactly the kind of effort we are currently missing.i believe both sides need more risk. i never meant to imply this idea could not be capable of meeting the need.upgrading local to eliminate all afk influence what if local chat changed, hunting the cloaked..."
8/7/2014,"just post your loss mail already. refer to, link"
8/7/2014,"even if ccp wanted to give a suspect flag to someone bumping another, there's no way for the game mechanics to differentiate one bump from another. the whole issue is based on the intent of the bumper and game mechanics can't determine such esoteric facts.i would like to see the actual bumping mechanic take the mass of each ship more into account, and have the bounces more closely adhere to physics. but that's just me and i can work around it if it never gets changed."
8/7/2014,
8/7/2014,
8/7/2014,
8/7/2014,
8/8/2014,"really? you manage to shoot yourself because of system lag ? really ?now you want to explain us how a ""high end computer"" works and why system lag kills every isboxer concept and you have to do all the commands veeeeeery slow. oops, first incursion ship is gone because you have to command your logistics veeeeery slow .....to be honest, it is not possible to shoot yourself in any situation with a good overview. it has nothing to do with the computer. but like you explained your travel problem earlier, sometimes you have to understand the mechanics first before you use an optimized method/third party tool.but anyways, isboxer is cool. we are discussion right now how bomb damage is calculated by the server. maybe it is possible to throw 255 bombs at the same time from the same spot ? depends on the damage calculation. if the server calculates them in a single time frame who knows, should be possible to hit a single server time frame with more than 8 bombers. would open the possibility to change complete fleet battles as a single player with a single bomb run."
8/8/2014,"you're welcome to try having 255 accounts synched in a perfect order and bomb a fleet with bombs. no really, if you can get all your 254 remaining accounts up to bomber t2 status, i'll even put my entire 8man mining team on the grind for you to bomb.let me know when you have the hardware and setups to even try this thing.until then, stop making ridonculous comments with irrelevant numbers that nobody uses. if everything is ""so easy"" as you portray in your fanatically ridonculous posts, why aren't there alliances wiping current low/null residents/renters off the map with the easy mode isboxer usage?maybe, just maybe you'll sometime in some form realize, that isboxer fills a certain niche of gamplay, but doesn't in fact replace real people behind the computer.but hey, if you can't handle multiple accounts, i'd say you should look at the following two common problems.pebkacid 10 t"
8/8/2014,"i would say a happy medium between an orca and a freighter, maybe slightly higher to account for material costs.i am the one who exists in shadow. i am the devil your parents warned you about."
8/8/2014,"afk cloaking is a no-risk venture you say? okay.. well, i guess until he has to uncloak to attack. that's the exact moment he becomes at risk. the person is also at risk every time he changes system.now you'll say ""not if he comes in via cover cyno"" and i'll counter with ""someone has to light that beacon in the first place.""."
8/8/2014,"i very much agree.i would point out that cloaking is quite balanced, in fact, as demonstrated by the stalemate between it and docked pve ships.to me, the problem is lack of resolution to conflicts, with both sides having a perfect defense.the defense needs to erode on both sides, for balance to be maintained.upgrading local to eliminate all afk influence what if local chat changed, hunting the cloaked..."
8/8/2014,"you need less than month to get to bs. after several month you will have quite developed skills for bs and t2 frigates, and covops, and many other basic things to fly in eve. imo, 2-3 month untill getting to most basic things in mmo is more than favorable offer."
