4/1/2015,"the moment i read about eve, i knew this was not wow.i played wow with an uk 18+ yrs guild for 5 months but i wanted to try a sandbox mmo.before playing eve i printed out a stack of 20 cm of guides how the game worked, from different sorts of ammo to you name it even then it did not register this game was about pvp at it's core, i learned that the hard way.after months of skill training learning skills and selling a gtc for learning implants, hehe... i undockedit took me a month to get into a catalyst and i could barely fly it well, even bought it with the isk i made myself.it felt pretty good to fly around in such a big ship shooting rats and surviving, so onward to greener pastures !the catalyst jumped to other systems laid down by the autopilot, hehe you know where this is going."
4/1/2015,please put
4/1/2015,i endorse this service and/or product.
4/1/2015,"upper right corner of the screen. it's a little box that reads ""search forums"" and contains a little magnifying glass. as far as i know, it's the job of the isd to moderate the forums, not do your research for you."
4/1/2015,"it's a well-known fact that beating a dead horse does not, in fact, return the horse to life so you can beat it back to death again.if people stopped being stupid and actually searched the forum for old threads themselves, they wouldn't get repetitive threads locked. and then isd or ccp's community devs don't have to waste time doing the same searches or keeping a long post-it note of redundant thread urls."
4/1/2015,"this tbh, so no to the op.destination skillqueue:- it's like assuming the lions will ignore you in the savannah, if you're small, fat and look helpless."
4/1/2015,"""if people stop being stupid...""if you can make people stop being stupid, we won't have the forum spam issue that needs a realistic solution.""if people just be friends, we won't have war.""""if people don't sleep around, we won't have aids."""
4/1/2015,the background colors of all overview items can be edited in overview settings. it would be nice if everything on the hud could have it's color edited though.
4/1/2015,"in csm9 he came in 34th out of 36, and in csmx he came 19th out of 75, so i'm not sure your analysis is entirely accurate."
4/1/2015,pretty damed good imo
4/1/2015,yeh not bad at all. going for csm xi next year.
4/1/2015,you have my blasters
4/1/2015,
4/1/2015,
4/2/2015,"if you dropped a dread blob on a carrier blob and lost you ain't doin something right.... sieged dreads will nuke carriers every time so unless your going one on one (which is the epitome of stupidity in a fleet fight) you really need to fire your dread pilots and get new ones . you also need numbers, like it's been stated you don't need a massive dread blob to win but at the same time you can't throw a handful of dreads at them and expect everything to go in your favor. and yes neuting carriers does work, armageddons are ideal anti cap ships since they got the remake into neut boats. you just need to learn to use them properly instead of 1 on 1 only as your using to argue your misguided point -_- 1 neut boat against 1 carrier just makes the carrier pilot laugh and go hey that tickles as it crushes your armageddon with its fighters...edit....throwing battleships against a carrier blob without dread support is just asking to be humiliated"
4/2/2015,"nodes are the issue ... my dread was cycling guns for dozen of minutes , firing but not using ammo and not doing any damage. on paper concept looks good,but only on paper"
4/2/2015,"a lot of players that never tried eve before, see the long skillqueue, see the advantages of two +4 implants and they don't want to lose those implants, so they don't pvp, they stay in high-sec and get bored, then leave the game. learning implants are a real barrier for new players trying to enter null-sec. they need skills fast. they also need to pvp. they also need isk and can't afford to lose 40 million each time they die. what to choose? why do players have to make this choice: fun or isk ($$$) ?so - , give us a +4 boost to all attributes. the money ccp will lose because of shorter training times will be a lot less than the money won because players fight, destroy more ships, are not afraid to pvp, have more fun and stay in the game."
4/2/2015,"and what do you replace them with to avoid gutting the lp market?not saying i'm against the idea, but they're an lp and isk sink that would probably want replacing."
4/2/2015,"no, we're not going to crash the market just so some people can justify their obscene risk aversion. implants are a choice, and what's more they are a meaningful choice. that is a good thing."
4/2/2015,"if you must know i am a carer for my partner which brings in little money but leaves me with a fair amount of spare time when i am not needed. i mine a lot and theorized i can at a stretch including refining, manufacturing etc make 300mil/daythat's 109,500,000,000 over the course of a year subtract 40% for wastage and times i cant make target 65,700,000,000 or approx 82 plex which is a large part of the way, if i buy the rest or can just use part cash part plex then i might just have the finds to attend a fanfest for once"
4/2/2015,"i honestly doubt ccp could pull off getting partner groups to accept plex as payment for services, or the promise of reimbursement from ccp's coffers for accepting plex as a payment. even if the partner services accepted plex, they'd somehow need to coordinate with ccp to provide ways for payment to go through, which would be potentially ridiculous amounts of extra work and maintenance costs for an event that only happens once a year. on top of that, there's other associated nasties of providing services for space monopoly money that'd make me balk if i was a vendor being approached by ccp for partnering."
4/2/2015,i suppose a simple way to do it is for ccp to buy x tickets and rooms and accept the plex themselves but then if they buy in advance they risk losing money if they buy after then they risk not having rooms/flights available.
4/2/2015,"flights to and from the us need a purchasing customer's name and other identifying info at the time of booking so tsa can pre-screen passenger lists. tsa, at least, is not going to bend that for ccp bulk purchasing tickets without passenger names.if ccp handles travel affairs for fanfest on a per-customer basis, they pretty much turn into caribbean cruise productions. and although i would love to see ccp guard and ccp fozzie in resort wear while they slave away booking my vacation, that's a waste of resources."
4/2/2015,"dear csm,some proposals for forums updates in the following topic.forums : new features.may you speak about this subject in your meetings with ccp ?it would be interesting to have also some news about forums changes in the new updates site.thanks for your time."
4/2/2015,the second run was the stv thing to find the 2 candidates with the most votes... the ones with the permanent seats.
4/2/2015,"no, you won't...edit: just for clarification since you seem to struggle with reading comprehension, i said you wouldn't get elected with your campaign. my prediction was spot on. you weren't elected. so the only thing majestic about this was the fact that i even graced you with my presence. you're welcome. i'll give you free advice next year too."
4/2/2015,are you going to run a serious campaign next year rather than the joke campaign from this year?
4/2/2015,"lol, its him again...... marmite fan boys, got to love them."
4/2/2015,"i'll take that to mean that no, it'll still be a joke campaign. thanks."
4/2/2015,"and again, lol.... he must love me long time."
4/2/2015,thread closed at the polite request of the op.isd ezwal community communication liaisons (ccls)
4/2/2015,
4/3/2015,"i'm actually excited about dust514 being profitable. i haven't turned on my ps3 in ages, but when i did play dust it was actually pretty fun. for my personal tastes, i can't play repetitive things like arena games or lobby shooters. i prefer to explore. give me a wasteland to explore and find shiny things, shoot monsters, discover and learn about eve lore. somewhere so vast that i may bump into someone, or i may not. i don't want a themepark experience. perhaps fallout 3 + witcher 3 + mass effect. that would be so fun. scanning planets and taking the shuttle down but it's impossible to be so accurate that you land where you want. if someone else is also hunting the same treasure at the same time, then they land miles away, but you're both tracking to the same beacon.... one can only dream, right? :)"
4/3/2015,"the only dread that doesn't use ammo per se is the revelation, other then that you had to be using ammo cause either the server doesn't let you activate anything at all (wouldn't be the first time i've run across that) or everything works fine and you aren't paying attention. i've seen dread blobs butcher carrier groups so it doesn't look good ""on paper"" it actually works. you just cannot or will not do it properly from the degree of how much it isn't your fault your throwing out there..."
4/3/2015,"this certainly plays into the whole ""do attributes serve a purpose?"" angle. i'd venture to say no. they really don't serve a purpose other than to make the oldest players feel good about shuffling some arbitrary numbers around once a year.learning implants of course exacerbate the issue. i completely agree they should go, as they're a risk aversion multiplier and stupidly expensive way to suck time (the only really valuable resource) away from players. and of course older players have the most isk to buy them, giving them an accelerating and compounding advantage over their existing skill point head start.learning implants can 100% be removed and replaced with pretty much any other implant and continue to supply meaningful choice, as well as isk and lp sinks, into the game."
4/3/2015,i agree and even made a thread about it:
4/3/2015,i support this.
4/3/2015,"wtf y'all smoking? you seriously want something for nothing ""give us a +4 boost to all attributes"" that makes the implants meaningless, oh right, that's your intention. swing the nerf bat again ccp cause the kiddies can;t play in their sandbox without pooping in it.implants are supposed to cost you something,,,,, simply because they give you a advantage over another player, or allow you to compete on their level. if your afraid of getting podded every time you undock, then this game is not for you,. you want all the benefits of the implants, but not the risk, shame on you.soot"
4/3/2015,"the myth that older players somehow get this compounding/accelerated advantage with implants is falseall implants do ocne you have 20+ mil is somewhat mitigate the obscene amount of time that you now have to devote to each skill to get it leveled, ratio wise per skill were advancing just as fast as a noob, sp wise were going up faster, but thats because we have more distance to cover per skill than the new guysnot to mention they are currently an lp/isk sink, and id venture to say probably one of the larger lp store sinks"
4/3/2015,as someone flying around regularly with 500m to 2b in implants i assure you i appreciate the risk/reward they provide. however there's a difference between hardwires and pirate implants that affect gameplay and learning implants you can plug into a market trading alt that doesn't undock. theres no reason attribute implants can't be swapped for something with more meaningful gameplay impact.
4/3/2015,"while i can see and agree to some extent on some arguments, for the removal of learning implants and attributes. none of them include the ridiculous notion, that they somehow stopped people from pvp.let's make one thing clear here, you are gaining a bonus in training by wearing them. if you wish for that bonus to be permanent for all, then remove attributes and give everyone a fixed training amount per hour for all skills. just stop with the whole ""i can't pvp with them in"" bulls**t. destination skillqueue:- it's like assuming the lions will ignore you in the savannah, if you're small, fat and look helpless."
4/3/2015,"while i am personally a fan of plex for tickets etc, i doubt for legal/logistics/cost reasons ccp could do what you are asking. it would basically require them to front the logistics of thousands of players' travel arrangements instead of just printing out tickets/badges etc.that said, i will try to keep the importance of plex as a payment option (where possible) top of mind."
4/3/2015,"they did a test program in '14 where yu could use plex to buy beer and things at some local shops and at fan fest. my guess is, it either was not very popular or it did not work out so well, because they did not see to repeat the process nor expand it this past fan fest. so i highly doubt you will ever have them do 'plex for tickets'"
4/3/2015,
4/4/2015,100% agree with this article.
4/4/2015,why would anyone have to get +4? why not just zero? necessity is the plea for every infringement of human freedom. it is the argument of tyrants; it is the creed of slaves. - william pitt
4/4/2015,"+1the attributes/remap system is bad because it forces to decide between combat and support skills if actually used, else there exists an optimal average mapping. learning implants do nothing to help you when undocked and pose a form of pay-to-win or keep"
4/4/2015,"hello guys.i've been thinking about the recent announcements about the new sov system, as well as the new ideas for structures, and they both seem to fit very nicely into a concept i had a while back. this might be a bit too much but please give it a think, and if not exactly to this, maybe look to having a similar setup in the future.here's the general idea: most alliances that hold sov in-game have a certain system they use the most frequent, and therefore label it as their 'hq'. i think that the hq should take a big role in sov warfare, as it is the core of an alliance's territory. where new structures are concerned, the hq should have it's main structure (or only structure, depending on the plans for how many structures are allowed in a system) anchored to a planet specifically. that planet should have 1 district, of which that 1 district has an anchoring 'node', that keeps the structure in fine order, much how a pos has to be anchored, as well as it's defences and structures being strapped onto it. this 'node' should be conquerable by dust 514 players. i know that involvement with other eve games has been a big wish to have expanded, and i think that the involvement of dust players in sov warfare should be crucial, but mainly only in the hq system. most alliances have a dust corp, and i feel that the dust corps are going to waste.so it goes like this: the hq structure can be upgraded with different modules, with some defending it, and others giving bonuses to sov in the same region of the alliance that holds that hq. for example, if brave's hq is ge-8jv, their main structure will be anchored on a planet, and on that planet, they own a node, which keeps the bonusing modules fitted to the main structure working. these bonuses should determine how difficult it is to take systems in that region, belonging to brave. the node on the planet owned by brave is attackable by other alliances with a dust corp, in the form of a dust match. lets say pl deploys their dust corp onto the brave planet in a match against brave, and the match will determine whether brave keeps control of the bonuses on their main hq structure or not.lets say pl win the match, and take over the node. at that point, bonuses in the region are shut down, as well as any defensive modules fitted on the hq's structure. at that point, the structure is more vulnerable to a proper attack, of which the entosis module is used on the structure, and then is taken over. brave will have then lost their hq system, as well as defensive bonuses for their sov in their specific region.note: one other idea i had was to make it so all sov brave owned in the same constellation of their hq would be taken over also, but this would be incredibly overpowered, unless if the defence of the hq was able to be extremely good.one more thing: the use of capitals seem to be of little to no use in the upcoming changes. i had an idea that capitals and supercapitals should influence the difficulty of how easy or hard it is to take a certain system, just by having them there.maybe having more on-grid field presence will make it so the system is harder to take, or maybe even impossible to take over, just because the defending team have a heavier field presence. of course, this would also be overkill in certain systems, so maybe this should only be allowed in certain systems.that's just a brainfart of my hq idea, and how to balance out the upcoming changes, making it so a bunch of interceptors can't take down a whole grid worth of systems.thanks for reading, o7"
4/4/2015,"why should people playing a completely different game, on a completely different system, with no real way for eve players to actually interact with them have anything to do with how we hold sov?by shut down upgrades, do you mean turns off all the ihub stuff? if so, why should losing a dust match kill a titan you happen to have in build, break jumpbridges, disable ratting/mining upgrades and all the rest of it? there is absolutely nothing we. as eve players, can do to stop this.if something affects what i do in eve the counter should be in eve, not in dust."
4/4/2015,"please change the 2.5ly jump range to 4ly. there are several areas where you cant move a carrier to a neighboring region without lighting a bunch of cynos to go around or jumping through a gate. as for the gate thing, caps have always had to use cynos to move, jumping gates with them is dumb."
4/4/2015,"you haven't provided a reason for the reversal of the nerf. it was a bad nerf, but let's have something other than 'it's dumb'.caps have always had issues with region jumps, using gates is a hell of a lot easier than the old ways of getting dreads into fountain, or anything over the tenal-cobolt edge gap."
4/5/2015,"so just use the gate. for those long region jumps jumping through a gate is a heck of a lot more convenient than cynos ever were. sure it changed some dynamics but this is an mmo, things are going to change over time.also, as someone else mentioned, you haven't actually provided a reason for reverting this change other than ""i don't like it""."
4/6/2015,"dear csm 10 and members of new eden,for quite some time now there has been a disparity between the effectiveness of sp invested into turret and sp invested into missiles. i have waited patiently for ~1.5 years since ccp ytterbium said that missile requirements could be a good thing to look at. while i understand that this may be too late to get looked at for the missile rebalance that will likely coincide with the release of the jackdaw, i hope with the csm's help we can fix this issue once and for all in a release soon after.in this topic i will show that a single sp invested into a base missile skill is worth ~1/2 of a single sp invested into a base turret skill. i will also show that a single sp invested into a missile support skill is worth ~1/3 of a single sp invested into a turret support skill. i will end with making some proposed recommendations as to ways to solve this issue. (note: all training times are at 2700sp/hour)first up base skills: speadsheet imageissue: it takes twice as much sp to train all the base missile skills to v as it does to train any one of the turret based weapon systems base skills to v. this means that a single sp invested into a base missile skill is worth ~1/2 of a single sp invested into a base turret skill.second up: specialization skills: spreadsheet imageissue: there isn't one. they all match up! yay!third up support skills: spreadsheet imageissues: not only does it take more sp to train all of the missile support skills (~1.5 mil more sp without controlled burst, and ~1 mil more sp with it), but the missile support skills only apply to a single weapon system. any sp invested into turret support skills is worth three times as much when compared to missile support skills because the turret support skills affect three weapon systems.so what are the overall totals for sp invested? take a look. it turns out that it takes 3.32 mil more, far less effective, sp invested into missiles to get the same effectiveness as you would by maxing a single turret system. something i found interesting is that drones take the least overall sp investment. which is why i didn't make any comparisons between turrets, missiles, and drones.so... what does this all mean? it means don't train missiles. the amount of time and sp you invest into missile training will be better served training any turret based weapon system. in fact, the sp you save will put you well on your way to fully training another turret based weapon system.how do we fix it?what i am hoping you will recommend to ccp will be something similar to this: break up the base turret skills into specialized base skills. for example, break small projectile turrets into small autocannon turret and small artillery turret skillbooks. option a: set the training time for each specialized base turret skill to half of what the generalized skill was. in other words, set small autocannons training time to half of what it took to train small projectile turrets. (doesn't add any training time.) option b: set the training time of the specialized base turret skills to what the generalized skill was. in other words, set small autocannons training time to equal what it took to train small projectile turrets. (doubles the training of the base turret skills.) set the training time of the base missile skills to the training time of the equivalent base turret skill. (if you went with option a you will have to refund excess sp that was spent in missiles. if you went with option b you will have to give away sp like when ccp made racial destroyers/bcs.) that's all pretty quick and easy and solves the issue of single sp invested into a base missile skill being worth ~1/2 of a single sp invested into a base turret skill. solving the issue that a single sp invested into a missile support skill being worth ~1/3 of a single sp invested into a turret support skill will be a little harder and uglier. the best solution could take many forms. here is what i would recommend: unify the turret and missile support skills. essentially have the same support skills apply to both turrets and missiles. a theoretical example of that this may look like. refund excess sp that was invested into either missile or turret support skills.now i am sure that some of you will be quick to note that there are a myriad of differences between missiles and turrets. when i brought up the idea in f&i there were many posts about how missiles always hit, ""rapid"" missile systems don't exist in similar forms for turrets, light and heavy missiles both apply to two sizes of weapons due to the ""rapid"" missile systems, missiles are used on more hulls than any single turret system is, and many more reasons as to why missiles deserve longer training times. it was pretty easy to debunk these as they are not issues with the training times of the weapon systems, but flavor differences between the weapon systems and potential imbalances that should be fixed by buffs or nerfs applied directly to the weapon systems themselves. so i ask you when considering my proposal you understand that what should matter is effectiveness gained by sp investment. the base skills grant you x effectiveness, specialization skills grant you y effectiveness, and support skills grant you z effectiveness. if xyz for missiles equals xyz for projectiles the the cost to acquire xyz should be the same. with your help we can make this a reality. thank you.i will be watching this thread so feel free to post any questions or comments you have."
4/6/2015,reserved for an faq.
