4/14/2015,"ok so soon we will have had much of the promised stuff done, corps, starbases and much more, so personally i would rather ccp take a few months with a big team once the big stuff is done and finish this feature. as i understand it was quite far along, but the deployment of the feature was too slow and underwhelming and with that it meet with much criticism (a riot in jita ), but with the new dev cycle i dont see having a big team on this to get it to deployment as an issue. there are many people who still dream of their space bar, or being able to have a corp or alliance meeting in an office on a space station somewhere. plus with the new structures promised being able to walk about them would be a nice bonus, having to go to a command center to take control of the weapons would be very cool, or have a situation room where you can plan and command battles that kinda thing would be fun."
4/14/2015,i endorse this product and/or service.i am the one who exists in shadow. i am the devil your parents warned you about.
4/14/2015,"i think it can be solved much easyer..if you bought a implant and your pod is destroyed:>>you will have a copy in your clonebay to be used again , i think that would be a much more smarter thing to do in that case you keep the market going and you will have more choices for the next clone in the clone bayand you are not affraid of losing 800 + mil of isk the next time ,so pvp can be more atractive for the people who dont pvp because of that..so taking the pvp ""willingness"" away from the clone... improves the game and yes i am a miner in hs > and refuse to get killed in low (because of the expensive cloon stuff),and yes this game is very boring for me to ...so this is a good topic ..but ccp is not intrested in this kind of behaviour or topicsit is so called player driven they say , ...but it is not...they make money on it so they keep it this way ..but also a lot of people disapear from the game after a while and thats true tofor me personaly my last goal is on the way (own build charon) ,and after that there is none (for me in hs) annymore so i guit perhaps to as a miner (also called carebear) i refuse to get blown up in low with my expensive clone in it"
4/14/2015,"rather than removing my options, why don't we increase your options?"
4/14/2015,do we really need to have a method to speed up learning? especially ones that benefit the oldest and richest players? why not just flatten it out and find new uses for implant slots?
4/14/2015,if learning implants are going to stay i very much like the idea of moving them to slots 7-9. it is the interference with pirate sets that bothers me most. learning drugs would be great but this does favour rich players.
4/14/2015,how do learning drugs intrinsically favour rich players?
4/14/2015,"because they will be high demand items that will have an isk cost. someone like me can buy millions of them and keep them stocked in stations everywhere to stay boosted 24/7.new players probably won't even know they exist and will have to choose between learning faster or buying another atron.and unlike current implants, you can't save money just by playing more carefully. a new player who is very alert won't lose their +3s because they won't get podded in hisec/lowsec. in your booster system the new player will always run out, whereas rich players will never run out."
4/14/2015,"how do they not? either they are expensive enough that players need to consider whether they are worth the isk which favors the wealthy, or they are so cheap that they just become mandatory and everyone uses them without thinking. the later case adds nothing but busy work to the game, while the former favours the wealthy. there needs to be some trade off to using them to make the choice meaningful and isk is not the best choice as it favours established players."
4/14/2015,"i originally liked the idea of boosters, but the problem i see is the general message to the players. pay $$$ subscription and get a running skill queue. pay or grind and get a faster queue. this is far better than pay or grind more and unlock the fun, but still not good imo."
4/14/2015,"you ran into your own law on this one, malc."
4/14/2015,"i have removed a rule breaking post and those quoting it.the rules:8. use of profanity is prohibited. the use of profanity is prohibited on the eve online forums. this includes the partial masking of letters using numbers or alternate symbols, and any attempts at bypassing the profanity filter. isd ezwal community communication liaisons (ccls)"
4/14/2015,"you can quote and misquote him if you wish, it still doesn't help your cause. why you may ask? well because once it was explained to him, he dropped it like a hot potato. you see the market lies about every order, as none of them are ever guaranteed. none. so if any change is required, i would say it is to inform pilots of that fact.but that is quite frankly, irrelevant. because that is not your issue here. your issue is that fact that you judged a single buy/sell order, as reflecting the true price of an item. if you had taken the time to gather more information of it's true value, you wouldn't then have paid over the odds for said item.this is what happened:a. there you were, looking at someone offering a good price for an item and it just so happened someone else was selling that item for less. you thought 'lol, someone's really dropped a clanger and i could make some quick easy money here, off the back of some poor clueless pilot'. you then bought said item for an inflated price and the buy order failed. well if ever someone counted chickens before they were hatched, you did. as no order is ever guaranteed. so there you are, left with over priced goods. which you can still sell at a loss, so that's a bonus. i guess.this is what should have happened:b. you saw someone offering a good price for an item and it just so happened someone was selling it for less. you should have then thought, 'oh, i could make some isk here, let me check to see if that buy and sell order reflects the true value of that item.'after checking you would have said to yourself, 'oh dear, some muppet is going to fall for that, if they don't do the proper checks.' or even bought the item far cheaper elsewhere and still tried to sell it to the buy order. just for giggles.but you went with a and then topped it off with a forum whine, just to show everyone how bad you are at market pvp.destination skillqueue:- it's like assuming the lions will ignore you in the savannah, if you're small, fat and look helpless."
4/14/2015,"i would love to understand why i am being attacked for trying to get something done about the margin trading scam or fraud as the case may be. whether i was scammed or not it does not matter whatsoever. i really do not understand the way a faction of eve players value fraud. you can try to divide and conquer me all you want. i will not back down on this issue. when a buy order is up and has a price. the toon or corp. which placed that buy order should pay. they should pay by losing isk or loss of standings or loss of skill points to the margin trading skill. in rl there are severe penalties for margin trading fraud. in eve there is no risk for doing so whatsoever. no risk to cheat the market and the newbs. to me that is unacceptable. i really find it horrendous that we have people in this forum that want nothing to do with fixing a scamming/fraud problem. there is something so blatant in this thread that needs to be looked at. oh this guy is butt hurt cause he got scammed. no, i didn't get scammed. it was pure and simple fraud. fraud is not acceptable in any known market except in eve. that is a problem.i am asking an begging any csm member who reads this to please look at this problem. look at it closely and understand that its the client that needs to be fixed. i don't want the margin trade skill gone. i believe it is good for the game. the eve client needs to represent truth."
4/14/2015,"the lack of sympathy you find here is because the margin trading scam is not some exploit that allows another player to sneak into a new player's wallet and steal their isk as you seem to want to portray it. the scam is basically just false advertising, similar to many other scams out there that attempt to trick a mark into making a poor trade decision by confusing, misleading or lying to a player about the value of a particular trade good. it is the player's greed that blinds them the risks of buying some module they have never heard of to sell for a quick profit, or at a price way above the historic value (which the client provides accurately). tricking a player like this is not an exploit my friend, that is market pvp.the problem with increasing penalties is that it hurts legitimate users of the margin trading skill. whenever i trade on margin (which is most of the time as with all serious traders) i already am careful about straying too close to my limit as failed orders are penalized by loss of my broker fees. if you added some punitive penalty it would hurt more market traders than any scammers, but the real problem is what will you say if the margin trade scammer accepts the consequence of the punishment? if some penalty was put in place and you, or someone like you, fell for the scam six months down-the-line, you will come to the forums complaining that the penalties are not tough enough as you managed to still get scammed (just like all those people that lose an overloaded transport ship coming here to demand more ""consequences"" for suicide gankers). and the cycle would continue until the margin trading skill was unusable. i have no problem with adding more information to the client to help traders identify potential problem orders. if 3 years from now ccp decides that they want to completely re-write the market trading system, i would have no objection to colour-coding orders that were made on margin, or that lacked enough isk to cover if they can do that. for now though, everything ccp said has indicated this is not technically possible, and even if it was, it really should be a low priority for developer resources since there are plenty of other ways to trick people into thinking something is worth more than it is."
4/14/2015,"because ""fraud"" is in the eye of the beholder.from my perspective... you are removing money from people with more greed and money than intelligence. and you gain intelligence through experience. and you gain experience by going through the situation it yourself. and then you realize that the ""horrible thing"" that happened to you actually made you think, act, and behave smarter. because there is always another such ""horrible thing"" around the corner.(for disclosure: i fell for the margin scam early in my eve life... i now look very closely at anything i buy and sell rather than ""right-click, done"")this isn't real life.the context of eve is a dystopia. it's not meant to ""work right"" or be ""fair."" it's meant to be an exercise in darwinism. and the market is probably the closest you will ever get to a ""pure"" libertarian market model... which expresses that darwinism mantra very well. i mean seriously... the game is full of megacorporations and empires stripmine ""lush and verdant moons"" to construct massive supercapital ships... sometimes with slave labor... to wipe out hundreds of thousands of ships in single engagements... each ship with crews numbering from the dozens to the thousands... all the while rival factions within each megacorporation and empire send in pirates to shoot and assassinate at each other... or commandeer one of the aforementioned supercapitals and pile drive it into a station to destroy any chance of peace talks... while another faction simply goes out hunting for victims on the spacelanes and literally drain their bodies of blood for ritual sacrifices... and you, the mighty immortal... a being given power through implants that are not even designed for your physiology... a being that is designed to wage war, conflict, and amass wealth in the hopes you will work on behalf of your empire... slaughter all of them wholesale... before making a mistake and losing several thousand of your crew... whose families will never be notified or paid any compensation... because **** you, you have more important matters to look into... like buying a new battleship...*breathes*oh... there is a risk. there is always a risk.however that risk is dependent on other players actually understanding what it is you are doing. and most people don't have a mind for economics... much less economics with few rules or restrictions.but yeah... there are ways to throw a wrench into a market manipulator's plans. and there are ways you can screw over a margin scammer. you just have to understand the rules and toss any rl notions of ""morality"" or ""ethics""...... which, frankly, have no place in a game. all that matters are the ""rules"" and ""spirit"" of the game, in the context of the game itself.we'll agree to disagree here. some of the best stories of eve are where one person screws over a whole mass of people. or a whole mass of people burn everything ""just cause.""examples:the end of bobthe end of goonswarm v1the eve intergalactic bank scamsocratic's downfallthe first revenant killgoonswarm ice interdictionhulk-a-geddonpos-a-geddonthe game needs less ""free intel"" and give more opportunities for people to scam and cause more conflict. because conflict is fun!!"
4/14/2015,"if rule 1 of eve is ""don't fly what you can't afford to lose"" then rule 2 is ""if it looks too good to be true then it probably is.""this goes for bait ships, op ships (they'll get nerfed sooner or later), and strangely lucrative looking market orders."
4/14/2015,"scams are fraud, so yes, you got scammed. that you keep ranting without sharing the juicy details of the story makes me think we're talking in excess of 10 billion.any chance of the scammer coming forward and telling this riveting tale?"
4/14/2015,"no, that is eve.you got greedy and didn't gather all the relevant information, before making an investment. you still have the goods, but paid way more than their true value. no one but you is to blame. suck it up.destination skillqueue:- it's like assuming the lions will ignore you in the savannah, if you're small, fat and look helpless."
4/14/2015,"i feel like your head would explode if you knew about fractional reserve banking irl...the real world revolves around margin stuff just like eve does. for traders it's nice not to have 30% of your capital tied to orders that might not fill for weeks.if you do 30 seconds of research, you'll see that it's probably a scam of some sort.then you're mad about not having any repercussions, well there's nobody stopping you from hiring a merc to deal with the person. you could just as easily go after them yourself.ccp won't do anything about this ""broken"" mechanic because there is nothing broken about it."
4/14/2015,i took the liberty of fixing your post.
4/14/2015,"in eve, if it looks too good to be true, not only is it definitely too good to be true, but you are about to take it up the keister if you don't move out with a quickness.eve is not a game of fair, with the single exception of everyone gets to play by the same set of rules. how i use those rules to screw you over, kill your ship, steal your loot, and deprive you of your economic opportunities. however, is completely open, and i in no way obliged to treat you with honesty, respect, or any sense of ethical consideration.you are a victim, waiting for the axe to fall, until you come to terms with that.(it took me three years to figure that out, and i still ocassionally get butt plowed when i leap before i look).eve is like an addiction; you can't quit it until it quits you. also, iderno"
4/14/2015,and the continuation of climbing the ladder begins again....
4/14/2015,"no, you're just upset over some pixels."
4/14/2015,hand up everyone in this thread who personally discussed this issue with ccp rise face to face and can therefore claim equal understanding of his intentanyone...?bueller? anyone?
4/14/2015,"as an advancing player in eve online, i have often wondered why there is not an option to pay to have your skill points reset, allowing a player to respend already trained skill points.this would allow one to change play styles and reduce the amount of time it takes to go from one style of game play to another.basicly for a fee of $30.00 to as much as $60.00 once every 30 days, a player could log into their account management website, and pay to have all their skill points reset. except for the basic skill points a fresh character starts with, all current trained skill points would be removed from skills allowing the player to log in and re spend his or her points to the desired skills they wish to have benefits from.as training skills is a matter of time, and money, starting out a player may want to try a bit of everything before they narrow down on a game style path. being able to rest and re spend those skill points no longer going to be used will save them more time and allow them to move along quickly into their new choices.i would gladly pay to have this done. as i have chosen to step away from mission running to go into industrial aspects of the game.would love to hear feedback from others and hope those who can make this happen see it's value."
4/14/2015,"because this is eve, where your choices have consequences.if the meta changes from the current sentry ishtars and rail tengus to something more like pulse legions and arty lokis, then it should not take a <U+FFFD>15 payment to ccp to immediately change my skills from a perfect tengu pilot to a perfect legion pilot with absolutely no effort on my part.if you make the choice to train tengus over legions in this situation, then you reap the consequences when the meta shifts."
4/14/2015,"this is a terrible idea for many reasons but the most simplest is that it makes skill choices inconsequential. allowing a respec, even for a monetary cost, would remove any individuality from characters as any 60m sp character is exactly the same as any other. if it were to happen it would have to be in a limited form (not a complete reset) and at a penalty like 2:1 or 3:1 sp exchange. personally, i think the value of the individuality and history of each character is more important than some impatient player moving a few million sps around. if you want a new skill focus, start a new account/character or just head to the character bazaar and pick one up."
4/14/2015,how about if i could pay $30 to have all your skill points randomised?
4/14/2015,"i understand, the aspects of your disagreement.but unlike most mmo's, a character going from one aspect of the game to a whole new aspect has little to no effect on the actual character itself. as the player still remains the same.as far as tech 3 ships go, if you don't hybrid then your just an idiot to begin with. as any good pilot in eve knows choices are key when it comes to missions and to pvp.limiting oneself to just one class of ships is kinda not worth it. when there are advantages to training and skilling all 4 classes.by that i mean amarr, caldari, gallente, and minmatar class ships."
4/14/2015,"but eve is not real life, and as such, is just a game.it's no different than training a paladin in world of warcraft, find out you hate being a tank, pay out the gold to have your talents reset and respec your character to holy.if you don't wish to pay to change your skills around, then don't.but for those who would wish to try a new avenue of the game without the hours and hard earned cash they have already paid out go to waist to train a new character or to blow isk to buy someone elses character, then paying to have your trained skill points reset becomes valid.it has little to no real consequence to either ccp or the community on a whole. it's another source of revenue for them."
4/14/2015,can you exp;lain why you feel that choices made in a game that is all about the consequences of your actions should carry no consequences?
4/14/2015,"one, the client doesn't currently support his, nor does the new skins system seem to support actually changing the model on a ship.also creating or adjusting models is a lot of work, and creates more work for every new ship skin they create, so it's impractical for them to make different versions of every ship for every player who happens to not like a new model (or an old one, or whatever)."
4/14/2015,
4/14/2015,
4/14/2015,
4/14/2015,
4/14/2015,
4/15/2015,"yeah, what they said. boosters would presumably be reasonably expensive or they would just be a default (no choice). so people who can afford to pay for a continuous supply are effectively trading isk for sp."
4/15/2015,"none of the above. why? because the fix to your problem is already available.like i said earlier, if any change is required, it's to inform pilots that no order is guaranteed.what you are asking for, is a way that means those greedy lazy types, don't get caught out by their own actions, or should i say lack of. you're asking for the removal of consequences, when they try and screw over other market players and it backfires, due to their incompetence.but judging by your lack of understanding of the current mechanics, i doubt that even a warning would have helped you. you would still be here, informing us of just how bad you are at the game. if there was ever a time a corp name was apt, this is it.destination skillqueue:- it's like assuming the lions will ignore you in the savannah, if you're small, fat and look helpless."
4/15/2015,cmon keep attacking me. when there is smoke there is fire.
4/15/2015,"the game doesn't need fixing. player ignorance needs fixing. that's what ccp needs to fix. to be fair, the margin trading skill doesn't explain that margin trades will fail on empty wallets. ccp doesn't need to explain the consequence of it; merely the facts. let players piece things together themselves."
4/15/2015,"as it seems not many in this thread like what i am trying to do. the basic, mere basic of risk is one sided on this issue. when i say one sided i mean there is 0 risk for the buyer when done correctly. 0 risk for the buyer. his name isn't given out, he is protected. no one knows who he is. there can be no retaliation against him. he is more protected than anyone else in this game. call me greedy all you want but the guys doing the buy orders with ultimate protection are just as greedy as anyone else in this game. the buyer has 0 risk against them. the person many of you are defending has no risk in this game. we all talk a good game about risk but risk should go both ways. i want to know who is screwing me over when i get screwed over. if this is market pvp then i want it like ship pvp. i want to know who didn't take the order. who took their money out of their wallet. if you lose your ship i guarantee you are looking at that combat log. looking to see who killed you. i bet that combat log has the names of those who just shot you. well the guys who sell to these buyers don't get that. don't start with the sellers because that is a different toon that does that. we know the names of the toons we buy from. if a buy order is issued whether it goes through or not you should at least get the name of the toon. that would be risk on the buyers part. i would be happy if they had at least some risk in this game instead of being fully protected and anonymous."
4/15/2015,"friend, let the bitterness go. you were tricked by another player and lost some isk. learn from your mistake and move on.even if you knew the name of the character that listed that market order, in all likelihood there is nothing you could do to him or her. as a market-focused character they might never undock, and as the market is anonymous (until a purchase is made) there is no simple way you can know what orders or trades they are participating in. your best bet for revenge is to look for similar scam buy orders where you were scammed and use some of the methods discussed in these forums to mess with that scammer. but really, for your mental health, just chalk it up as a pvp loss and a learning experience and let it go."
4/15/2015,"but there is risk.the scammer has just spent broker's fees... non-refundable broker's fees. these fees scale in proportion to how overpriced the items asked for are. they've committed an amount of money to initiate the scam. if nobody bites, that's money lost. further, if nobody bites, they may have an item nobody is going to buy off them. margin trading scams are often done on low-velocity items. these are items that are rarely sold because they're both; crap, and hard to acquire. so, there is risk. it's just not the risk you happen to want."
4/15/2015,very little risk at all. ooooooooo brokers fees. its too risky....
4/15/2015,"so, when you get the letter/e-mail from the nigerian prince about how he'll send you a pile of cash if you provide him your banking information, do you smile and send out your account number, or do you recognize that the deal is too good to be true and trash the letter? same. basic. principle.the market of eve operates under the rule of caveat emptor. your inability to properly research market orders is not a problem for ccp to address."
4/15/2015,ccp has a song written for you.
4/15/2015,you're not even trying to hide your tears anymore. you should honestly just have the isd lock the thread for the sake of your dignity.
4/15/2015,"reported for redundancy.oh and no.destination skillqueue:- it's like assuming the lions will ignore you in the savannah, if you're small, fat and look helpless."
4/15/2015,please use the search forums function to find similar threads from the past. this suggestion has come up numerous times. thread locked for redundancy.
